song	link	album	lyrics
Evil Eyes	https://www.allthelyrics.com/lyrics/dio/evil_eyes-lyrics-68270.html	Album: The Last In Line	"In the land of the lost horizon
Where the queen lies dark and cold
When the stars won't shine, then the story's told
When the world was milk and honey
And the magic was strong and true
Then the strange ones came and the people knew
That the chains are on
In the land of no tomorrow
Where you pray just to end each day
And your life just slowly melts away
Each day you hear the sand as it moves and whispers
Come and sail on my golden sea
Maybe one day you'll be just like me...and that's free
But still your chains are on
You've seen them walking on the water
You've seen flying through the sky
They were frightening in the darkness
They had rainbows in their eyes
When the world was milk and honey
And the magic was strong and true
The the strange ones came and the people knew
That the chains are on"
Evil On Queen Street	https://www.allthelyrics.com/lyrics/dio/evil_on_queen_street-lyrics-68314.html	Album: Lock Up The Wolves	"Dio : Evil Eyes (1983, Dio)
===============
Hide in the midnight
Turn out the lights you see them anyway
Sail into never
They follow wherever you can go
And take you to the places you don't know
No, no
It's the call of the city
The way the blacks pretty to the purest heart
Is places of pleasure
They promise the treasure if you fly
And then there goes the soul of you and I
Oh do you ever think about the way
I caught the rainbow
I'll be there when fire makes you dance
I'm gonna give you the look
That opens up the skies
I've got evil eyes
Evil eyes
Evil eyes
Evil eyes
Yes evil eyes
Ooh those eyes
Look high in the night time
Turn out the lights they see you anyway
Sail into never
They follow wherever you can go
Evil eyes
Evil eyes
Evil eyes
Evil eyes
Evil eyes
Evil eyes
Take your lies
Evil eyes
You've been in the skies
For what you are
Evil eyes
Sail into never
They'll follow you forever
'Cos they're evil eyes
Evil - Evil - Evil - Evil - Evil - Evil - Evil Eyes"
Evilution	https://www.allthelyrics.com/lyrics/dio/evilution-lyrics-68312.html	Album: Strange Highways	"Spent the night on the road
And never saw the miles go
Running away
Got to get free from myself
Stories were made to be told
and here's the one that I know
I can't hide it anymore
There's evil on Queen Street
Saw the house in the dark
It seemed to say ""come touch me
I've got a heart
Open the door to my soul""
Climb to the top of my stairs
And look into my windows
I can be your wishing well
There's no evil on Queen Street
Let me inI can warm in the heat of your fire
It's no permanent sin to be bad
If you're sorry
Let me go - you're a promise that comes from a liar
I don't know - if I ever can wash all the evil away
Struck a match at the dark
It screamed no, no I love you
Together we're strong
You always believed what I'd say
But now the heat of a flame
Can start me to remember
There's no evil - evil
No evil on Queen Street
Just smoke in the air
No evil anywhere
No evil on Queen Street"
Faces In The Window	https://www.allthelyrics.com/lyrics/dio/faces_in_the_window-lyrics-68302.html	Album: Dream Evil	"Good night, we're closing again
Come back, we're open tomorrow
We've finished today
I'm just staying away
We know what's good for the brain
Oh, plastic dreams and fast machines
Pushing it to the limit
Girls and boys who think that noise
Is music in the air
Twisted felon, stay awhile
Here's your invitation
Dirty rags and body bags
Evilution
Hello, we're open once more
Come in, you need no appointment
We're thinking in time
That you'll move down the line
And represent the business in hell
Well, well
Tell her hope is gone but you carry on
We can set the soul free
All is lost so what's it costs
To listen anyway
The world upstairs where no-one cares
Is just about to crumble
See it through we'll burn for you
Evilution company
Oh, neon names play neon games
Showing it to the public
I hate you and you hate me
And everybody smiles
So money talks and no-one walks
But everybody's crawling
Golden rags and body bags
Evilution
Hello, good night, it's me
I'm open again
Come back, come in, good bye
We're closed"
Fallen Angels	https://www.allthelyrics.com/lyrics/dio/fallen_angels-lyrics-68291.html	Album: Sacred Heart	"Give me - shelter - shelter
I can face the day
Then I'll just fade away
Give me shelter
Give me shelter
Sleep comes - slowly
The fire starts to die
You open up your eyes
Faces in the window
Noises in the night
Faces in the window
Hiding from the light
Faces in the window
We are - evil
And we are all divine
Creations of the mind
We are pleasure
I see - clearly
Who's behind the wall
Yes, I can see us all
We're faces in the window
Noises in the night
Faces in the window
Hiding from the light
Faces in the window
Give me shelter - shelter - shelter
Give me shelter - shelter - shelter
Faces in the window
Noices in the night
Faces in the window
Hiding from the light
Faces in the window
Faces in the window
Faces in the window
Faces in the window
When the fire starts to die
And you open up your eyes
There they are in the window
Faces in the window
We are evil and divine
Just creations of the mind
And faces in the window
Faces in the window
Faces in the window
Faces in the window
Faces in the window
Faces in the window"
Feed My Head	https://www.allthelyrics.com/lyrics/dio/feed_my_head-lyrics-68349.html	Album: Magica	"Hiding in a corner
Waiting for the storm
Maybe they'll forget about me
Avoid connection
Still they say you always surrender
All the smiling faces
Promising the sun
Another way of breaking you down
All is lost
Hope is dead
Feed my mind
Fill my head
Hope is gone
The spell's been said
Fill my mind
Feed my head
Ah
Waiting for my number
To climb upon the cross
Maybe they'll forget about me
Must avoid detection
But they say you'll still go down
Safe in dreams
Away from where they are
Let me be nowhere
Just another star
Safe in night
The shadows cloak their eyes
Take me to nowhere
Where everybody flies
Oh!
All is lost
Hope is dead
Feed my mind
Fill my head
Hope is gone
The spell's been said
Fill my mind
Feed my head
All is lost
Hope is dead
Feed my mind
Fill my head
Hope is gone
The spell's been said
Fill my mind
Feed my head
All is lost
Hope is dead
Feed my mind
Fill my head
Hope is gone
The spell's been said
Fill my mind
Feed my head
All is lost
Hope is dead
Feed my mind
Fill my head"
Fever Dreams	https://www.allthelyrics.com/lyrics/dio/fever_dreams-lyrics-68338.html	Album: Magica	"Lately when my demons drag the night across my eyes
I just can't seem to fight it anymore
Yield unto temptation and be ruler of the world
But it seems that I have heard that song before
And the voices begin to sing - Come home
I have seen some evil as I've walked upon the earth
But this is way beyond what eyes can see
Wicked is as wicked does and if I lose control
Is this the way that hell is gonna be
Have I fallen too far to rise
Been burning too long in the fire
Then it all falls down - Tearing the night away
It must be - Fever dreams
Fever dreams
Fever dreams
Now before my demons roll the night across my eyes
I tremble as I wait perhaps to sin
Yield unto temptation and be ruler of the world
And all I do is let the beast come in
Have I fallen too far to rise
I've been standing too long in the fire
Let it all fall down
Tearing the night away
It must be - Fever dreams
From the outside - Fever dreams
Oh, fever dreams
Fever dreams
Ooh-ooh
Fever dreams
Fever dreams
Fever dreams
Fever dreams
Fever dreams
Fever dreams"
Firehead	https://www.allthelyrics.com/lyrics/dio/firehead-lyrics-68313.html	Album: Strange Highways	"Screaming out alone in the night
Just a time and place
But it's real all right
We are diamonds that shine without fire
We're climbing the stairsGoing down and never higher
Fallen Angels
Going down
Something came to me in a dream
The crack of a gun and a bloody scream
The I could see the faces and why
I was holding the gun
And the world began to die
It's a criminal world
And we all get to play
You're a criminal
Sins of the children
Never get washed away
We're Fallen Angels
Goin' down
Fallen Angels
Come gather round
Screaming out alone in the night
Just a time and placeBut it's real all right
We are diamonds that shine without fire
We are climbing the stairsGoing down and never higher
We're Fallen Angels
Fallen Angels
Fallen Angels"
Give Her The Gun	https://www.allthelyrics.com/lyrics/dio/give_her_the_gun-lyrics-68317.html	Album: Strange Highways	"Who's that angry man I see
Is he coming closer
Well I'll just make believe
That I've never been afraid
Crackle, Crackle,
You're all dead
Feel the heat from firehead
From spooky stories that he's read
They put pictures on his body
Living out a fantasy
To be the last one left alive, hah!
Crackle, Crackle,
You're all dead
Feel the heat from firehead
He's lost the instruction
No control
Suicide fever, he won't be much older
I know, won't go, away
What's that smoke that I can see
Rising from the ashes
Well, it seems that there will always be
Someone just like you
Crackle, Crackle,
And you're all dead
Feel the heat from firehead, firehead, firehead!"
God Hates Heavy Metal	https://www.allthelyrics.com/lyrics/dio/god_hates_heavy_metal-lyrics-68344.html	Album: Angry Machines	"[Japanese CD only]
One more nightmare
No place like home
You see a picture of angels
I see a nail in the wall
Make him over
No time to lose
And if you've heard this one before
Don't stop me
Don't stop me
We learn slowly
Evil's in the holy
Incidental
God hates heavy metal
So I know he must hate me
Lazy-crazy
Must be my name
Why are you running to nowhere
Why do you listen to noise
So if you've heard this all before
Please stop me
Please stop me
Live don't preach it
If you can't don't teach it
Accidental
God loves heavy metal
So I know he must want me
We learn slowly
Mind control is holy
Stir don't shake it
Move too fast you'll break it up
Incidental
God is heavy metal
So I know he must need me"
Golden Rules	https://www.allthelyrics.com/lyrics/dio/golden_rules-lyrics-68333.html	Album: Angry Machines	"She heard this song before
Daddy's at the door
Just to say I love you
Please, please, don't let him in
Is it all beginning again tonight?
Somebody make it right!
I say: Give her the gun!
Look at him run away
Give her the gun
Before the next one comes along
And doesn't pay
He, dragged into the cold
Momma sold her soul
For one more ride to heaven
Please, someone let him in
Is it all beginning again tonight
Can anyone make it right?
I say: Give him the gun!
Look at her run away
Oh, give him the gun
Before the next one comes along
And doesn't pay
Simply unforgivable, destruction of the heart
Does anybody tell
Make yourself invisible
Be blinded by the light
We're hiding away, what would they say
Yeah
She played this song before
Daddy's at the door
Just to say hello, ahh
Now, in a different world
Is it all beginning again tonight
Oh, I got to make it right
I say: give her the gun
Look at him run away
Oh, give her the gun
Before the next one comes along
Give her the gun
Look at him falling down
Oh, give her the gun
Before the next one comes along
'Cause it goes round and round and round..."
Guilty	https://www.allthelyrics.com/lyrics/dio/guilty-lyrics-68365.html	Album: Killing The Dragon	"He'd never tell her lies
And she believed in magic
But when the magic died
She could see that all along he's just been
Guilty - a liar, liar
Guilty
Guilty - burn in fire
Guilty
It's time to say goodbye
Don't tell another story
Another alibi
Now you see that all along he's just been
Guilty - a liar, liar
Guilty
Guilty - you burn in fire
Guilty
Guilty - the great pretender
Guilty
You're guilty - just surrender cause you're guilty
Broken promise
But please forgive again
One more time for me
It's the very last time - you'll see
Guilty - liar, liar
You'll burn in fire
Guilty - liar, liar
Guilty
Guilty - the great pretender
Guilty
Guilty - just surrender, you're guilty
Guilty, guilty, guilty
A liar, liar
Guilty - you'll burn in fire
Oh guilty, you'll burn in fire
Surrender - guilty
So guilty"
Gypsy	https://www.allthelyrics.com/lyrics/dio/gypsy-lyrics-68272.html	Album: Holy Diver	"It's been a long hot road I've been upon
Through the desert of your soul
I've looked high and low for water
But it's not there
All the promises of springtime
Turned to lies, so cold
But I'm stronger than you know
And I've come to let you go
Chorus:
Go eat your heart out
You've been a bad, bad girl
You've been hungry all of your life
So eat it out
I've been a prisoner just locked away
Inside your velvet jail
But it don't matter at all
Some things can grow without the light
Spinning cages for her pleasure
Weaving chains to hold the prize
Magic moments with the jailerAll on fire, and then he dies
(Repeat chorus)
We speed across emotions
And then we lose our hold
We move on wings of passion
That we can't control
(Repeat Verse 1)"
Heaven And Hell	https://www.allthelyrics.com/lyrics/dio/heaven_and_hell-lyrics-68339.html	Album: Inferno: Last In Live	"Sing me a song, you're a singer
Do me a wrong, you're a bringer of evil
The devil is never a maker
The less that you give, you're a taker
So it's on and on and on, it's heaven and hell
Oh well
The lover of life's not a sinner
The ending is just a beginner
The closer you get to the meaning
The sooner you'll know that you're dreaming
So it's on and on and on, oh it's on and on and on
It goes on and on and on, Heaven and Hell
I can tell
Fool, fool
Oh uh
Yeah, yeah, yeah
Well if it seems to be real, it's illusion
For every moment of truth, there's confusion in life
Love can be seen as the answer, but nobody bleeds for the dancer
And it's on and on, on and on and on and on and on and on and on
They say that life's a carousel
Spinning fast, you've got to ride it well
The world is full of kings and queens
Who blind your eyes and steal your dreams
It's heaven and hell, oh well
And they'll tell you black is really white
The moon is just the sun at night
And when you walk in golden halls
You get to keep the gold that falls
It's heaven and hell, oh no
Fool, fool
You've got to bleed for the dancer
Fool, fool
Look for the answer
Fool, fool, fool"
Here's To You	https://www.allthelyrics.com/lyrics/dio/heres_to_you-lyrics-68334.html	Album: Strange Highways	"She was straight from Hell
But you never could tell
Cause you were blinded by her light
She could crack your brain
With magic pain
And turn a paler shade of white
(Well) I was on the free
Just me and me
And just about to sail
When I heard the voice
Said you got a choice
The hammer or the nail
You'll be ridin'
You'll be ridin' on the gypsy
Well I rolled the bones
To see who'd own
My mind and what's within
And it's a given rule
That we're all fools
And need to have a little sin
So I'm ridin'
I've been ridin' on the gypsy
On the gypsy queen
She was straight from Hell
But you never could tell
Cause you were blinded by the light
So she cracked my brain
With magic pain
And turned my left around to right, right
So I'm ridin'
Yes I'm ridin'
I'm still ridin' on the gypsy
On the gypsy queen"
Hey Angel	https://www.allthelyrics.com/lyrics/dio/hey_angel-lyrics-68307.html	Album: Lock Up The Wolves	"Here's to you!
Here's to you! Here's to me!
Masters of the universe
The curse of destiny
All for one, it's one for all
Now you can pull the trigger
As we're knocking down on the wall
When you finally shoot too high
The lie will always bring it down
You resurrection angels,
Look what we found
That the wheel goes around
So here's to you!
Come on, raise the dead
Heads will roll
Cancel the infection
We can purify the soul
Do the crime
Then write the law
There's no wrong you can change it where
A change you've never saw
Hey, you desperation angels
Here we found
That they all fell down
So
Here's to me! Here's to you!
Here's to you! Here's to me!
Here's to reason!
Oh
Here's to me! Here's to you!
Raise the dead! Here's to freedom!"
Hollywood Black	https://www.allthelyrics.com/lyrics/dio/hollywood_black-lyrics-68321.html	Album: Strange Highways	"How do you feel right now
How does it feel to be alone
How do you feel right now
Tell me
Chorus:
Hey angel - what's your situation
Hey angel - oh, oh, oh
Where would you be right now
Waiting to taste your next tomorrow
Where would you be right now
Tell me
Was the pain too strong to take it anymore
So you turned off all the lights and shut the door
Chorus:
Hey angel - what's your destination
Hey angel
Hey angel - got a complication
You're my angel - angel - oh, oh, oh, oh, oh
How do you feel right now
How does it feel to be alone
How do you feel right now
How do you feel right now
Chorus:
Oh angel - you're my angel - angel - angel"
Holy Diver	https://www.allthelyrics.com/lyrics/dio/holy_diver-lyrics-68266.html	Album: Holy Diver	"Hmm hmm hmm hmm hmm yeah yeah
Holy diver you've been down too long in the midnight sea oh what's becoming of me
Ride the tiger you can see his stripes but you know he's clean oh don't you see what I mean
Gotta get away holy diver yeah
Got shiny diamonds like the eyes of a cat in the black and blue something is coming for you look out
Race for the morning you can hide in the sun 'till you see the light oh we will pray it's all right
Gotta get away get away
Between the velvet lies there's a truth that's hard as steel yeah
The vision never dies life's a never ending wheel say
Holy diver you're the star of the masquerade no need to look so afraid jump jump
Jump on the tiger you can feel his heart but you know he's mean some light can never be seen yeah
Holy diver you've been down too long in the midnight sea oh what's becoming of me no no
Ride the tiger you can see his stripes but you know he's clean oh don't you see what I mean
Gotta get away get away gotta get away get away
Holy diver sole survivor your honour's clean
Holy diver holy diver never cut in the middle comin' after you holy diver
Oh holy diver yeah alright get away get away get away
Holy diver holy diver whoa holy diver hmm hmm hmm hmm"
Hungry For Heaven	https://www.allthelyrics.com/lyrics/dio/hungry_for_heaven-lyrics-68284.html	Album: Sacred Heart	"Holy Diver
You've been down too long in the midnight sea
Oh what's becoming of me
Ride the tiger
You can see his stripes but you know he's clean
Oh don't you see what I mean
Gotta get away
Holy Diver
Shiny diamonds
Like the eyes of a cat in the black and blue
Something is coming for you
Race for the morning
You can hide in the sun 'till you see the light
Oh we will pray it's all right
Gotta get away-get away
Between the velvet lies
There's a truth that's hard as steel
The vision never dies
Life's a never ending wheel
Holy Diver
You're the star of the masquerade
No need to look so afraid
Jump on the tiger
You can feel his heart but you know he's mean
Some light can never be seen
Repeat verse 1"
Hunter Of The Heart	https://www.allthelyrics.com/lyrics/dio/hunter_of_the_heart-lyrics-68331.html	Album: Angry Machines	"You're a dancer
But you're dancing on air
Just a matter of time till you fall
You're a dreamer
One night at the fair
But still you want it all
You're in danger
The last of a line
But the vision lasts forever
So just hold on
You can make it happen for you
Reach for the stars and you will fly
You're Hungry for Heaven
Hungry for Heaven
Hungry for Heaven
But you need a little hell
You're a runner
But you're chasing yourself
Feel the hot breath on your shoulder
You're emotion
Running cold running warm
The young just getting older
We are sunlight
We can sparkle and shine
And our dreams are what we're made of
So just hold on
You can make it happen for you
Reach for the stars and you will fly
You're Hungry for Heaven
Hungry for Heaven
Hungry for Heaven
But you need a little hell"
I Am	https://www.allthelyrics.com/lyrics/dio/i_am-lyrics-784456.html	Album: Master Of The Moon	"I think I'm through with just pretending
Knocking at the door that I've been through before
Congratulations, at last you've seen my light
Now it's you against the night
I think I'm never coming after, after all
Now I've become the cat who always lets you know that
I am, I am, stronger than the wind
I am, I am sin
I am, I am, stronger without you
I am
For all the words come unspoken
Silence isn't gold, or the story's never told
Investigation, at last I've found my light
And we shine
So now I'm like the cat who always tells you this, that
I am, I am, stronger than the wind
I am, I am sin
I am, I am, better without you
I am
I think I'm way outside illusion
Breaking down the door that locked me in before
Congratulations, now that you've seen my light
After all
And when I become the cat, I'll always let you know that
I am, I am, stronger than the wind
I am, I am sin
I am, I am, I am, stronger without you
I am
I am, oh I am, I am
I am everyone
I am, I am, better without you
I am
I am, I am, stronger than before
I am, I am more
I am, I am, I am, ready to go on
I am"
I Could Have Been A Dreamer	https://www.allthelyrics.com/lyrics/dio/i_could_have_been_a_dreamer-lyrics-68296.html	Album: Dream Evil	"Hey liar, tell me your intentions are good
Knowing it could be a lie
I see how you rise
To question the eyes of anyone who promises pain
Contagious, something like a virus of love
Making the pleasure seem real
Another killing by the villain
Another body on the ground
Here comes the master of destruction again
I knew you from the start
Hunter of the heart
Cat crazy, never the predictable one
Asleep in the sun now the strike
Possession today, then send it away
After all the joys in the taking
Another beating by the villain
Another angel fallen down
Here comes the master of destruction again
Perfect for the part
Hunter of the heart
Another burning by the devil
And another diamond turned to glass
Here comes the master of destruction again
I knew you from the start
Hunter of the heart
Hunter of the heart"
I Speed At Night	https://www.allthelyrics.com/lyrics/dio/i_speed_at_night-lyrics-68269.html	Album: The Last In Line	"Running with the wolf pack
Feel like I'm never coming back
And everytime there's sunshine
I'm blind, yeah
I am everybody
And everyone that I know is me
Everyone that I know won't see
I could have been a dreamer
I could have been a shooting star
I could have been a dreamer, yeah
I'm another number
And you know the numbers must agree
But everytime the wind blows
I can't fly - why?
We take away tomorrow
And never see the end of today
Lock it up and send it away - forever
I could have been a dreamer
I could have been a shooting star
I could have been a dreamer
Cause dreams are what we are
I could have been a dreamer
Running with the wolf pack
Feel like I'm never coming back
But maybe that was sunshine
That I saw
I've heard about a rainbow
I've heard it makes you crazy
I think I'm goin' crazy
Crazy cause I see
I could have been a dreamer
I could have been a shooting star
I could have been a dreamer
Cause dreams are what we are
I could have been a dreamer
I could have been the one to fly
I always could have been a dreamer
Cause dreamers never die, no!
I could have been a dreamer
Dreamer
I could have been a dreamer
Dreamer
I could have been a dreamer
Dreamer
I could have been a dreamer"
In Dreams	https://www.allthelyrics.com/lyrics/dio/in_dreams-lyrics-784458.html	Album: Master Of The Moon	"Help me
Save me
I've just crossed the line where reason might betray me
Wake me
Oh shake me
Send a message to my brain before they take me
How can I get through to you that wishes just come true
In dreams
Oh don't go
No don't dare
'Cause the journey drives you mad before you get there
Help me
Oh save me
I'll be glad to give you back the hand you gave me
How I can get through to you that wishes do come true
In dreams
In your dreams
If I'm a river then you're the sea
Somewhere you'll find me
Alone swimming here in the ecstasy
If I'm silence you must be scream
But I don't hear you
I'm in a place that I've just never seen before
No, don't go
You'll never save me
I've just slapped away that helping hand you gave me
Don't wake me
No, don't you shake me
Here's a message from my brain, you'll never take me
How can I get through to you that wishes do come true
In dreams
In my dreams"
Institutional Man	https://www.allthelyrics.com/lyrics/dio/institutional_man-lyrics-68335.html	Album: Angry Machines	"Dark touches send rushed through the brain
Black's whiter, burns brighter than the flame
No shadows, just whispers in the wind
No faces, just places to begin
I just come seeking pleasure, I hate the light
I speed at night, at night
My demons, they seem to disappear
No vision, I only see to hear
Protection, I never needed none
Direction, just nowhere near the sun
You've go some stairs to heaven, you may be right
I only know in my world, I hate the light
I speed at night
(Repeat Verse 1)
You've got some stair to heaven, you may be right
I only know in my world, I hate the light
I speed at night"
Invisible	https://www.allthelyrics.com/lyrics/dio/invisible-lyrics-68280.html	Album: Holy Diver	"Inside the walls I've made
To keep out all who reach for me
I might have lost my way
And I can't come out again
Don't come around here anymore
You may infect yourself
Don't ever cross this line
You could see monsters in your mind
There just like me
Have I erased all sense of touch
I don't feel anything
Sometimes they say I need
Sometimes I think I need
Sometimes I know I need
New parts for my brain
Most dreams, they're black and white
But I must color mine
Each day's another end
Less night of screaming
Shouting at the outside
Someone let me in
Set me free now no-one can
Faces at the window
Stop the water, bags of sand
Institutional man
Sometimes they say I need
Sometimes I think I need
Sometimes I know I need
New parts for my brain
Set me free now no-one can
Faces at the window
Lock the cages, tie my hands
Institutional, institutional man"
