song	link	album	lyrics
Coma	https://www.allthelyrics.com/lyrics/guns_n_roses/coma-lyrics-28078.html	Album: Use Your Illusion I	"Hey you caught me in a coma
And I don't think I wanna
Ever come back to this...world again
Kinda like it in a coma
'Cause no one's ever gonna
Oh, make me come back to this...
world again
Now I feel as if I'm floating away
I can't feel all the pressure
And I like it this way
But my body's callin'
My body's callin'
Won't ya come back to this...
world again
Suspended deep in a sea of black
I've got the light at the end
I've got the bones on the mast
Well I've gone sailin',
I've gone sailin'
I could leave so easily
While friends are calling back to me
I said they're
They're leaving it all up to me
When all I needed was clarity
And someone to tell me
WHAT THE ***** IS GOING ON
GODDAMN IT!
Slippin' farther an farther away
It's a miracle how long we can stay
In a world our minds created
In a world that's full of shit
HELP ME
HELP ME
HELP ME
HELP ME
BASTARD
Please understand me
I'm climbin' through the wreackage
Of all my twisted dreams
But this cheap investigation just
Can't stifle all my screams
And I'm waitin' at the crossroads
Waiting for you
Waiting for you
WHERE ARE YOU
No one's gonna bother me anymore
No one's gonna mess with my head no more
I can't understand what all the fightin's for
But it's so nice here down off the shore
I wish you could see this
'Cause there's nothing to see
It's peaceful here and it's fine with me
Not like the world where I used to live
I NEVER REALLY WANTED TO LIVE
ZAP HIM AGAIN
ZAP THE SON OF A ***** AGAIN
Ya live your life like it's a coma
So won't you tell me why we'd wanna
With all the reasons you give it's
It's kinda hard to believe
But who am I to tell you that I've
Seen any reason why you should stay
Matbe we'd be better off
Without you anyway
You got a one way ticket
On your last chance ride
Gotta one way ticket
To your suicide
Gotta one way ticket
An there's no way out alive
An all this crass communication
That has left you in the cold
Isn't much for consolation
When you feel so weak and old
But is home is where the heart is
Then there's stories to be told
No you don't need a doctor
No one else can heal your soul
Got your mind in submission
Got your life on the line
But nobody pulled the trigger
They just stepped aside
They be down by the water
While you watch 'em waving goodbye
They be callin' in the morning
They be hangin' on the phone
They be waiting for an answer
When you know nobody's home
And when the bell's stopped ringing
It was nobody's fault but your own
There were always ample warnings
There were always subtle signs
And you would have seen it comin'
But we gave you too much time
And when you said
That no one's listening
Why'd your best friend drop a dime
Sometimes we get so tired of waiting
For a way to spend our time
An ""It's so easy"" to be social
""It's so easy"" to be cool
Yeah it's easy to be hungry
When you ain't got shit to lose
And I wish that I could help you
With what you hope to find
But I'm still out here waiting
Watching reruns of my life
When you reach the point of breaking
Know it's gonna take some time
To heal the broken memories
That another man would need
Just to survive"
Come Together	https://www.allthelyrics.com/lyrics/guns_n_roses/come_together-lyrics-28127.html	Album: Chinese Democracy	"Here come 'ol flatttop
He come groovin' up slowly
He got ju ju eyball
He one holy roller
He got hair down to his knee
Got to be a joker he just do what he please
He wear no shoeshine
He got toejam football
He got monkey finger
He shoot Coca-Cola
He say I know you..you know me
One thing I can tell you is you've got to be free
Come together...right now
Over me
He Bag Production, he got
Walrus gumboot, he got
Ono sideboard, he one
Spinal cracker, he got
Feet...down below his knee
Hold you in his armchair you can feel his disease
Come together...right now
Over me
He rollercoaster, he got
Early warning, he got
Muddy Water, he one
Mojo filter, he say
One and one and one is three
Got to be good lookin' 'cause he's so hard to see
Come Together...right now
Over me
Come together...yeah
Come together...yeah
Come together...yeah
Come together...yeah"
Crash Diet	https://www.allthelyrics.com/lyrics/guns_n_roses/crash_diet-lyrics-28112.html	Album: Chinese Democracy	"Crash diet of reds'n'ludes
A shot of vitamin C and a bottle of booze
Too stupid to live with nothin' to lose
In your one track mind now
Where's that leave you
Drink'n'drive white lightning faster baby
Takin' your last ride
Now better be so careful or you'll be dead before you time
Sorry you took mother's car now
Tears in my eyes, baby please don't go
You bet (!) one too many, now one for the road
fresh outta detox, fresh from jail
Took your rehabilitation and you drove me to hell
Drink'n'drive white lightning faster
Takin' your last ride
Better be so careful or you'll be dead before your time
Sorry you took mohter's car now
Too soon, you thought ... !
Too late for the pressure and strain
Too bad for those who don't believe it
Ruby street still calls your name
[guitar solo]
Itchy trigger finger and the race to be alive
Smokin' a cig while you drink'n'drive
With no control in your life ahead
You're never gonna see if you wind up dead
Drink'n'drive white lightning faster
Takin' your last ride
Better be so careful or you'll be dead before your time
Drink'n'drive white lightning baby
It's always on your mind
Push or pull your limits baby, do it one more time
Break it down
Break it down
Somethin's changin', somethin's breakin'
You gotta be a brother, 'coz ! your family
!.... Oh make it
Sweet mystery, Ooohhhh
If you don't care about yourself
Would you please leave me alive
Oooohhhh...
You gonna
You gonna drink'n'drive
Oooohhhhh, Yeeaaah!"
Dead Horse	https://www.allthelyrics.com/lyrics/guns_n_roses/dead_horse-lyrics-28077.html	Album: Use Your Illusion I	"Sick of this life
Not that you'd care
I'm not the only one with
whom these feelings I share
Nobody understands,
quite why we're here
We're searchin' for answers
That never appear
But maybe if I looked real hard I'd
I'd see your tryin' too
To understand this life,
That we're all goin' through
(Then when she said she was gonna like wreck my car...
I didn't know what to do)
Sometimes I feel like I'm beatin' a dead horse
An I don't know why you'd be bringin' me down
I'd like to think that our love's worth a tad more
It may sound funny but you'd think by now
I'd be smilin'
I guess some things never change
Never change
I met an old cowboy
I saw the look in his eyes
Somethin' tells me he's been here before
'Cause experience makes you wise
I was only a small child
When the thought first came to me
That I'm a son of a gun and the gun of a son
That brought back the devil in me
Sometimes I feel like I'm beatin' a dead horse
An I don't know why you'd be bringin' me down
I'd like to think that our love's worth a tad more
It may sound funny but you'd think by now
I'd be smilin'
I guess some things never change
Never change
I ain't quite what you'd call an old soul
Still wet behind the ears
I been around this track a couple o' times
But now the dust is startin' to clear
Oh yeah!!!
Sometimes I feel like I'm beatin' a dead horse
An I don't know why you'd be bringin' me down
I'd like to think that our love's worth a tad more
It may sound funny but you'd think by now
I'd be smilin'
Ooh yeah, I'd be smilin'
No way I'd be smilin'
Ooh smilin'"
Don't Cry	https://www.allthelyrics.com/lyrics/guns_n_roses/dont_cry-lyrics-28066.html	Album: Use Your Illusion I	"If we could see tomorrow what of your plans
No one can live in sorrow, ask all your friends
Times that you took in stride, they're back in demand
I was the one who's washing blood off your hands
Don't you cry tonight, I still love you baby, don't you cry tonight
Don't you cry tonight, there's a heaven above you baby
And don't you cry tonight
I know the things you wanted, they're not what you have
With all the people talkin', it's drivin' you mad
If I was standin' by you, how would you feel
Knowing your love's decided and all love is real
And don't you cry tonight, don't you cry tonight
Don't you cry tonight there's a heaven above you baby
And don't you cry tonight
I thought I could live in your world as years all went by
With all the voices I've heard something has died
And when you're in need of someone, my heart won't deny you
So many seem so lonely with no one left to cry to baby
And don't you cry tonight and don't you cry tonight
And don't you cry tonight, there's a heaven above you baby
And don't you cry, don't you ever cry, don't you cry tonight
Baby maybe someday, don't you cry, don't you ever cry
Don't you cry tonight"
Don't Cry (Alt. Lyrics)	https://www.allthelyrics.com/lyrics/guns_n_roses/dont_cry_alt_lyrics-lyrics-161921.html	Album: Live Era 1987-93 (Explicit)	"(Stradlin / Rose)
If we could see tomorrow
What of your plans
No one can live in sorrow
Ask all your friends
Times that you took in stride
They're back in demand
I was the one who's washing
Blood off your hands
Don't you cry tonight
I still love you baby
Don't you cry tonight
Don't you cry tonight
There's a heaven above you baby
And don't you cry tonight
I know the things you wanted
They're not what you have
With all the people talkin' it's drivin' you mad
If I was standin' by you how would you feel
Knowing your love's decided
And all love is real
An don't you cry tonight
Don't you cry tonight
Don't you cry tonight
There's a heaven above you baby
And don't you cry tonight
I thought I could live in your world
As years all went by
With all the voices I've heard
Something has died
And when you're in need of someone
My heart won't deny you
So many seem so lonely
With no one left to cry to baby
An don't you cry tonight
An don't you cry tonight
An don't you cry tonight
There's a heaven above you baby
And don't you cry
Don't you ever cry
Don't you cry tonight
Baby maybe someday
Don't you cry
Don't you ever cry
Don't you cry
Tonight"
Don't Damn Me	https://www.allthelyrics.com/lyrics/guns_n_roses/dont_damn_me-lyrics-466827.html	Album: Use Your Illusion I	"Don't damn me
When I speak a piece of my mind
'Cause silence isn't golden
When I'm holding it inside
'Cause I've been where I have been
An I've seen what I have seen
I put the pen to the paper
'Cause it's all a part of me
Be it a song or casual conversation
To hold my tongue speaks
Of quiet reservations
Your words once heard
They can place you in a faction
My words may disturb
But at least there's a reaction
Sometimes I wanna kill
Sometimes I wanna die
Sometimes I wanna destroy
Sometimes I wanna cry
Sometimes I could get even
Sometimes I could give up
Sometimes I could give
Sometimes I never give a *****
It's only for a while
I hope you understand
I never wanted this to happen
Didn't want to be a man
So I hid inside my world
I took what I could find
I cried when I was lonely
I fell down when I was blind
But don't damn me
When I speak a piece of my mind
'Cause silence isn't golden
When I'm holding it inside
'Cause I've been where I have been
An I've seen what I have seen
I put the pen to the paper
'Cause it's all a part of me
How can I ever satisfy you
An how can I ever make you see
That deep inside we're all somebody
An it don't matter who you wanna be
But now I gotta smile
I hope you comprehend
For this man can say it happened
'Cause this child has been
condemned
So I stepped into your world
I kicked you in the mind
An I'm the only witness
To the nature of my crime
But look at what we've done
To the innocent and young
Whoa listen to who's talking
'Cause we're not the only ones
The trash collected by the eyes
And dumped into the brain
Said it tears into our
conscious thoughts
You tell me who's to blame
I know you don't wanna hear me cryin'
An I know you don't wanna hear me deny
That your satisfaction lies in your ILLUSIONS
But your delusions are yours and not mine
We take for granted we know the whole story
We judge a book by its cover
And read what we want
Between selected lines
Don't hail me
An don't idolize the ink
Or I've failed in my intentions
Can you find the missing link
Your only validation is living your own life
Vicarious existence is a ***** waste of time
So I send this song to the offended
I said what I meant and I've never pretended
As so many others do intending just to please
If I damned your point of view
Could you turn the other cheek
But don't damn me
When I speak a piece of my mind
'Cause silence isn't golden
When I'm holding it inside
'Cause I've been where I have been
An I've seen what I have seen
I put the pen to the paper
'Cause it's all a part of me
Don't damn me
I said don't damn me
I said don't hail me
Don't damn me"
Double Talking Jive	https://www.allthelyrics.com/lyrics/guns_n_roses/double_talking_jive-lyrics-28071.html	Album: Use Your Illusion I	"Found a head and an arm in da garbage can
Don't know why I'm here
Livin' on the run for oh so long
I gotta go collect
Double talkin' jive
Get the money *****
'Cause I got no more patience
Double talkin'
-I got (lies)-
No more patience man
Back in town an'a all new friends
They sayin' how ya been?
Fucked up and outta place
That's how I felt back then
Double talkin' jive
Get the money *****
'Cause I got no more patience
Double talkin'
-I got (lies)-
No more patience man
You dig what I'm sayin'?!"
Down On The Farm	https://www.allthelyrics.com/lyrics/guns_n_roses/down_on_the_farm-lyrics-28095.html	Album: The Spaghetti Incident?	"All I need is some inspiration
Before I do somebody some harm
I feel just like a vegetable
Down here on the farm
Nobody comes to see me
Nobody here to turn me on
I ain't even got a lover
Down here on the farm
They told me to get healthy
They told me to get some sun
But boredom eats me like cancer
Down here on the farm
Drinkin' lemonade shanty
Ain't nobody here to do me harm
But I'm like a fish out of water
Down here on the farm
I wrote a thousand letters
Till my fingers all gone numb
But I never see no postman
Down here on the farm
I call my baby on the telephone
I say come down and have some fun
But she knows what the score is
Down here on the farm
I can't fall in love with a wheatfield
I can't fall in love with a barn
When everything smells like horse shit
Down here on the farm
Blue skies and swimming pools
Add so much charm
But I'd rather be back in Soho
Than down here on the farm
On the ***** farm!
Are you born in a ***** barn or what?
Baaaaaah!
HOLD STILL"
Dust In The Wind	https://www.allthelyrics.com/lyrics/guns_n_roses/dust_in_the_wind-lyrics-28113.html	Album: Chinese Democracy	"Tell everybody that I am sorry, truly sorry
For all the wrong I've done
I never meant to hurt nobody, no no
Lord I never want to do no wrong
And I have lied, and I have begged and I have cheated
And I know my ship, it won't be coming in
And as I lay me down to take my rest
I can see that it's just dust in the wind
Take hold my hand, and hold it tighter, ever tighter
You must believe that I love you still
But my strength, it grows weaker, and weaker
And my body has lost its will
'Cause I have lied, and I have begged and I have cheated
And I know my ship, it won't be coming in
And as I lay me down to take my rest
I can see that it's just dust in the wind
Oh Lord, I have lost once again
And there's no one to help me find my way home
Lord and I, Lord I never want to hurt nobody
And I, Lord I never want to do no wrong
'Cause I have lied, and I have begged and I have cheated
And I know my ship, it won't be coming in
And as I lay me down to take my rest
I can see that it's just dust in the wind"
Dust N' Bones	https://www.allthelyrics.com/lyrics/guns_n_roses/dust_n_bones-lyrics-28064.html	Album: Use Your Illusion I	"(Stradlin / McKagan / Slash)
He lost his mind today
He left it out back on the highway
On  65
She loved him yesterday
Yesterday's over
I said okay
That's all right
Time moves on
That's the way
We live an hope to see the next day
That's all right
Sometimes these things they are so easy
Sometimes these things they are so cold
Sometimes these things just seem to rip you right in two
Oh no man don't let 'em get ta you
She loved him yesterday
He laid her sister
She said O.K.
An that's all right
Buried her things today
Way back out deep
Behind the driveway
And that's all right
Sometimes these women are so easy
Sometimes these women are so cold
Sometimes these women seem to rip you right in two
Only if you let 'em get to you
Ya get out on your own
And you/take all that you own
And you/forget about your home
And then you're/just fuckin' gone
There's no logic here today
Do as you got to, go your own way
I said that's right
Time's short your life's your own
And in the end
We are just
DUST N' BONES"
Estranged	https://www.allthelyrics.com/lyrics/guns_n_roses/estranged-lyrics-28089.html	Album: Use Your Illusion II	"(Rose)
When you're talkin to yourself
And nobody's home
You can fool yourself
You came in this world alone
(Alone)
So nobody ever told you baby
How it was gonna be
So what'll happen to you baby
Guess we'll have to wait and see
One, two
Old at heart but I'm only 28
And I'm much too young
To let love break my heart
Young at heart but it's getting much too late
To find ourselves so far apart
I don't know how you're s'posed
To find me lately
An what more could you ask from me
How could you say that I never needed you
When you took everything
Said you took everything from me
Young at heart an it gets so hard to wait
When no one I know can seem to help me now
Old at heart but I musn't hesitate
If I'm to find my own way out
Still talkin' to myself and nobody's home
(Alone)
So nobody ever told us baby
How it was gonna be
So what'll happen to us baby
Guess we'll have to wait and see
When I find out all the reasons
Maybe I'll find another way
Find another day
With all the changing seasons of my life
Maybe I'll get it right next time
An now that you've been broken down
Got your head out of the clouds
You're back down on the ground
And you don't talk so loud
An you don't walk so proud
Any more, and what for
Well I jumped into the river too many times
to make it home
I'm out here on my own, an drifting all alone
If it doesn't show give it time
To read between the lines
'Cause I see the storm getting closer
And the waves they get so high
Seems everything We've ever known's here
Why must it drift away and die
I'll never find anyone to replace you
Guess I'll have to make it thru, this time
Oh this time
Without you
I knew the storm was getting closer
And all my friends said I was high
But everything we've ever known's here
I never wanted it to die"
Every Rose Has Its Thorn	https://www.allthelyrics.com/lyrics/guns_n_roses/every_rose_has_its_thorn-lyrics-212946.html	-	"We both lost sight of steel in the dead of the night
Allthought we both lie close together
We feel miles apart inside
Was it something I said or something I did
Did my words not come out right
Though I tried not to hurt
Though I tried
But I guess that's why they say
Every rose has it's thorn
Just like every night has it's dawn
Just like every cowboy sings a sad, sad song
Every rose has it's thorn
I listen to her favorite song playin on the radio
Yeah the DJ say it's a game
Easy come and easy go
But I wonder does he know
Has it ever felt like this
And I know that you'd be here right now
If I coulda let you know somehow
I guess every rose has it's thorn
Just like every night has it's dawn
Just like every cowboy sings a sad, sad song
Every rose has it's thorn
Though it's been awhile now
I can still feel so much pain
Like a knife that cuts you
The wound heals
But the scar, the scar still remains
I know I coulda saved that night
If I'da known what to say
Instead of making love
We both made out seperate ways
Now I hear you found somebody new
And that I never meant that much to you
You hear that love inside
See you cuts me with a knife"
Garden Of Eden	https://www.allthelyrics.com/lyrics/guns_n_roses/garden_of_eden-lyrics-28074.html	Album: Use Your Illusion I	"It's a critical solution
And the east coast got the blues
It's a mass of confusion
Like the lies they sell to you
You got a glass jawed toothache
Of a mental disease
An they be runnin' round back
See 'em line up on their knees
'Cause the kiss ass sycophants
Throwin' penance at your feet
When they got nowhere to go
Watch 'em come in off the streets
While they're bangin' out front
Inside their slammin' to the cruch
Go on an throw me to the lions
And the whole damn screamin' bunch
'Cause the pissed-off rip-offs
'R' everywhere you turn
Tell me how a generation's
Ever s'posed to learn
This fire is burnin'
and it's out of control
It's not a problem you can stop
It's rock n' roll
I read it on a wall
It went straight to my head
It said 'Dance to the tension
of a world on edge'
We got racial violence
And who'll cast the first stone
And ***** is used anyway it can be
Sometimes when I look out
It's hard to see the day
It's a feelin' you can have it
It's not mine to take away
Lost in the garden of Eden
Said we're lost in the garden of Eden
And there's no one's gonna believe this
But we're lost in the garden of Eden
This fire is burnin'
and it's out of control
It's not a problem you can stop
It's rock n' roll
Suck on that
Looking through this point of view
There's no way I'm gonna fit in
Don't ya tell me what my eyes see
Don't ya tell me who to believe in
I ain't superstitious
But I know when somethin's wrong
I've been draggin' my heels
With a ***** called hope
Let the undercurrent drag me along
Lost in the garden of Eden
Said we're lost in the garden of Eden
And there's no one's gonna believe this
But we're lost in the garden of Eden
Most organized religions make
A mockery of humanity
Our governments are dangerous
And out of control
The garden of Eden is just another graveyard
Said if they had someone to buy it
Said I'm sure they'd sell my soul
This fire is burnin'
and it's out of control
It's not a problem you can stop
It's rock n' roll
Lost in the garden of Eden
(An we ain't talkin' about no poison apple or some missin' rib ya hear)
Said we're lost in the garden of Eden
And there's no one's gonna believe this
Said we're lost in the garden of Eden
This fire is burnin'
and it's out of control
It's not a problem you can stop
It's rock n' roll"
Get In The Ring	https://www.allthelyrics.com/lyrics/guns_n_roses/get_in_the_ring-lyrics-28083.html	Album: Use Your Illusion II	"Why do you look at me when you hate me
Why should I look at you when you make me hate you to
I sense a smell of retribution in the air
I don't even understand why the ***** you even care
And I don't need your jealousy yeah
Why drag me down in your misery
And when you stare don't you think I feel it
But I'm gonna deal it back to you in spades
When I'm havin' fun ya know I can't conceal it
'Cause I know you'd never cut it in my game- Oh no
And when you're talkin' about a vasectomy- Yeah
I'll be writin' down your obituary-
HISTORY
You got your bitches with
the silicone injections
Crystal meth and yeast infections
Bleached blond hair,
Collagen lip projections
Who are you to criticize my intentions
Got your subtle manipulative devices
Just like you I got my vices
I got a thought that would be nice
I'd like to crush your head tight in my vice- PAIN!!
And that goes for all you punks in the press
That want to start shit by printin' lies instead of the things we said
That means you
Andy Secher at Hit Parader
Circus Magazine
Mick Wall at Kerrang
Bob Guccione Jr. at Spin,
What you pissed off cuz your dad gets more ***** than you?
***** you
Suck my fuckin' dick
You be rippin' off the fuckin' kids
While they be payin' their hard earned money to read about the bands
They want to know about
Printin' lies startin' controversy
You wanta antagonize me
Antagonize me *****
Get in the ring *****
And I'll kick your bitchy little ass
PUNK
I don't like you, I just hate you
I gonna kick your ass,
Oh yeah! Ohyeah!
You may not like our integrity yeah
We built a world out of anarchy
Oh yeah!
AND IN THIS CORNER WEIGHING IN AT 850 POUNDS- GUNS N' ROSES
Get in the ring
Yeah
Yeah this song is dedicated to
All the Guns n'fuckin' Roses fans
Who stuck with us through all the ***** shit
And to all those opposed...
Hmm...well"
Hair Of The Dog	https://www.allthelyrics.com/lyrics/guns_n_roses/hair_of_the_dog-lyrics-28100.html	Album: The Spaghetti Incident?	"[spoken]
Give me a little bit of volume on this
You're a heart-breakin' soul shaker
I've been told about you
I've seen y'on the midnight show girl
A-what they been sayin' must be true
Red hot mama
There'll be trouble
I say time's gonna pay your dues
[CHORUS:]
Now you're messin' with a A SON OF A *****
Now you're messin' with a son of a *****
Now you're messin' with a A SON OF A *****
Now you're messin' with a son of a *****
Talkin' jive and poison ivy
You ain't gonna cling to me
Man take a bold thinker
I ain't so blind I can't see
Red hot mama
There'll be trouble
I say time's gonna pay your dues
[CHORUS]
[CHORUS (x 5)]"
Heartbreak Hotel	https://www.allthelyrics.com/lyrics/guns_n_roses/heartbreak_hotel-lyrics-28114.html	Album: Chinese Democracy	"Well, since my baby left me,
I found a new place to dwell.
It's down at the end of lonely street
at Heartbreak Hotel.
You make me so lonely baby,
I get so lonely,
I get so lonely I could die.
And although it's always crowded,
you still can find some room.
Where broken hearted lovers
do cry away their gloom.
You make me so lonely baby,
I get so lonely,
I get so lonely I could die.
Well, the Bell hop's tears keep flowin',
and the desk clerk's dressed in black.
Well they been so long on lonely street
They ain't ever gonna look back.
You make me so lonely baby,
I get so lonely,
I get so lonely I could die.
Hey now, if your baby leaves you,
and you got a tale to tell.
Just take a walk down lonely street
to Heartbreak Hotel."
