song	link	album	lyrics
Human Being	https://www.allthelyrics.com/lyrics/guns_n_roses/human_being-lyrics-28096.html	Album: The Spaghetti Incident?	"One, two, three four
Oh, yeah
Oh, yeah
Well if you don't like it, go ahead,
Find yourself a saint, go ahead now
Try to find a boy who's gonna be what I ain't
And what you need is a plastic doll with a fresh coat of paint
Who's gonna sit through all the madness always, act so quaint,
I said - a. Oh yeah, well - a.
It's your new friend, you're really
Making a scene, and I've seen you
Bouncing around, from machine to machine
But you know that
They're never really
Never really what they seem, and you can count on
Generate some warmth, then you'll
See just what I mean, oh baby, baby, baby yeah.
Then if I'm acting like a king, don't you know it's 'cause
I'm a human being, and if I
Want too many things, don't you know it's 'cause
I'm a human being
And if I've got to dream, don't you know it's 'cause
I'm a human being, and well if
It's a bit obscene, don't you know it's 'cause
I'm a human being
I don't gotta walk around with my head on down
Just like a human, oh no a human being
I can hold my head so high
Just like a human, a real proud human being.
Won't you give me a little sip why won't you give me a
Drag of that cigarette, why don't you
Try to give me something, that I'll
Never ever forget, but now
Could you blow it all, on a
Million dollar bet, because you're
Liable to lose it on a
Best lovin' you've had yet, oh baby baby, oh yeah.
Then if I'm acting like a king, don't you know it's 'cause
I'm a human being, and if I
Want too many things, don't you know it's 'cause
I'm a human being
And if I've got to dream, don't you know it's 'cause
I'm a human being, and well if
It's a bit obscene, don't you know it's 'cause
I'm a human being
I don't gotta walk around with my head on down
Just like a human, oh no a human being
I can hold my head so high
Just like a human, a real proud human being.
It's like I'm talkin' 'bout the human race
You're tryin' to cover up a big disgrace
Baby, yeah, yeah, yeah
Come on, come on, come on
Well I may think that this whole scene is just a
Too appalling for me
Well, I may be the type who's just mad about
Funny little thing that I see, but I can
Colour that with history, and make it
Just what I want it to be, well I'm
Blowin' my change on the fan magazines, with all the
Hollywood refugees, oh baby baby oh yeah.
Then if I'm acting like a king, don't you know it's 'cause
I'm a human being, and if I
Want too many things, don't you know it's 'cause
I'm a human being
And if I've got to dream, don't you know it's 'cause
I'm a human being, and well if
It's a bit obscene, don't you know it's 'cause
I'm a human being
I don't gotta walk around with my head on down
Just like a human, oh no a human being
I can hold my head so high
Just like a human, a real proud human being."
I Don't Care About You	https://www.allthelyrics.com/lyrics/guns_n_roses/i_dont_care_about_you-lyrics-28104.html	Album: The Spaghetti Incident?	"Yeah!
I'm from South Philadelphia up on Avenue C
I've seen empty hands that was waitin' to freeze
Up from the power at home
[CHORUS:]
I don't care about you
***** you!
I don't care about you
***** you!
I've seen Hollywood Boulevard
Welfare hotel
And I spent the night in jail
At the Wilcox Hotel
I don't care about you
***** you!
I don't care about you
I've seen an old man have a heart attack in Manhattan
Well he died while we just stood there lookin' at him
Ain't he cute?
I don't care about you
***** you!
I don't care about you
I seen mad rollin' drunks
I seen bodies in the streets
I saw a man who was sleepin' in his own puke
And a man with no legs crawlin' down
Fifth Street tryin' just to get somethin' to eat
I don't care about you
***** you!
I don't care about you
***** you!
I don't care about you
***** you!
I don't care about you
***** you!
[spoken]
Uh, that hurt man
Alright
Perfect"
Imagine	https://www.allthelyrics.com/lyrics/guns_n_roses/imagine-lyrics-505709.html	Album: Singles	"Imagine there's no heaven
It's easy if you try
No hell below us
Above us only sky
Imagine all the people
Living for today...
Imagine there's no countries
It isn't hard to do
Nothing to kill or die for
And no religion too
Imagine all the people
Living life in peace...
You may say I'm a dreamer
But I'm not the only one
I hope someday you'll join us
And the world will be as one
Imagine no possessions
I wonder if you can
No need for greed or hunger
A brotherhood of man
Imagine all the people
Sharing all the world...
You may say I'm a dreamer
But I'm not the only one
I hope someday you'll join us
And the world will live as one"
It Tastes Good, Don't It?	https://www.allthelyrics.com/lyrics/guns_n_roses/it_tastes_good_dont_it-lyrics-28126.html	Album: Chinese Democracy	"I'm like a little bitty kid with a real big mouth
And you're gonna have to catch me if you wanna wash it out,
Cuz I'll be standin' on the corner, callin' you names,
With my juvenile skills and juvenile games
Cuz I'm a fast motherfucker,
Let me tell you 'bout it sucker,
If you fuck with me, I'll fuck your mother,
Your sister, too, and your best girlfriend,
Then I'll line 'em up, and put 'em end to end,
And then I'll put (stick) it in, I'll pull it out,
I'll grab your face and then I'll cum in your mouth.
It tastes good, don't it
It tastes good, HUH
And you know it, OW!"
It's Alright	https://www.allthelyrics.com/lyrics/guns_n_roses/its_alright-lyrics-28115.html	Album: Chinese Democracy	"Told you once about your friends and neighbors
They were always seeking but they'll never find
That it's alright, yes it's alright
Where to go, Where to see
It's always been that way and it can never be
but it's alright, yes its alright
Give it all and ask for no return
And very soon you'll see and you'll begin to learn
that it's alright, yes it's alright"
It's So Easy	https://www.allthelyrics.com/lyrics/guns_n_roses/its_so_easy-lyrics-161933.html	Album: Appetite For Destruction (Explicit)	"I see your sister in her Sunday dress
She's out to please
She pouts her best
She's out to take
No need to try
She's ready to make
It's so easy, easy
When everybody's tryin' to please me baby
It's so easy, easy
When everybody's tryin' to please me
Cars are crashin' every night
I drink n'drive everything's in sight
I make the fire
But I miss the firefight
I hit the bull's eye every night
It's so easy, easy
When everybody's tryin' to please me baby
Yeah it's so easy, easy
When everybody's tryin' to please me
So easy
But nothin' seems to please me
It all fits so right
When I fade into the night
See me hit you
You fall down
I see you standin' there
You think you're so cool
Why don't you just
***** off
Ya get nothin' for nothin'
If that's what ya do
Turn around ***** I got a use for you
Besides you ain't got nothin' better to do
And I'm bored
It's so easy, easy
When everybody's tryin' to please me baby
It's so easy, easy
When everybody's tryin' to please me
So easy
But nothin' seems to please me
It all fits so right
When I fade into the night
So come with me
Don't ask me where 'cause I don't know
I'll try ta please you
I ain't got no money but it goes to show
It's so easy"
Just Another Sunday	https://www.allthelyrics.com/lyrics/guns_n_roses/just_another_sunday-lyrics-28125.html	Album: Chinese Democracy	"I know you've been dreaming 'bout the times in our lives
But I've been screaming in my bed late at night
A space a little, little and your stack of pain
Makes it grip that skull, to me child that you'll stay
You've been in my life so long, can I get through to you
I touch you eyes and it shades my life blue
There's something I need to say before it's to late
But I won't hold you back, while I'm begging you to stay
Just another Sunday
Just another Sunday
Oh yaaa, just another Sunday
Just another Sunday, oh yaaa
There's too many games in a day for a simple man to face
That desperate moment in your life where you can't be afraid
Don't think your second chance will break around the bend
'Cos hearts don't always share love, or the person on the other
end
You've been in my life so long, can I get through to you
I touch you eyes and it shades my life blue
There's something I need to say before it's to late
But I won't hold you back, while I'm begging you to stay ya
Just another Sunday yaa
Just another Sunday oh baby
It's only one more Sunday
Just another Sunday, oh yaaa
Those are tickets for the same plane, bring it back to me
'Cos felling the same pain makes half the luxery
Take a walk away won't end the carousel
But if walking away can bring you back, then I wish you well
You've been in my life so long, can I get through to you
I touch you eyes and it shades my life blue
There's something I need to say before it's to late
But I won't hold you back, while I'm begging you to stay
Just another Sunday yaa
Just another Sunday oh baby
It's only one more Sunday
Just another Sunday
It's just another Sunday
It's just another
Just another Sunday
Just another oh yaa
Just another Sunday"
Knocking On Heaven's Door	https://www.allthelyrics.com/lyrics/guns_n_roses/knocking_on_heavens_door-lyrics-28082.html	Album: Use Your Illusion II	"Mama take this badge from me
I can't use it anymore
It's getting dark too dark to see
Feels like I'm knockin' on heaven's door
Knock-knock-knockin' on heaven's door
Knock-knock-knockin' on heaven's door
Knock-knock-knockin' on heaven's door
Knock-knock-knockin' on heaven's door
Mama put my guns in the ground
I can't shoot them anymore
That cold black cloud is comin' down
Feels like I'm knockin' on heaven's door
Knock-knock-knockin' on heaven's door
Knock-knock-knockin' on heaven's door
Knock-knock-knockin' on heaven's door
Knock-knock-knockin' on heaven's door
Knock-knock-knockin' on heaven's door"
Live And Let Die	https://www.allthelyrics.com/lyrics/guns_n_roses/live_and_let_die-lyrics-28065.html	Album: Use Your Illusion I	"When you were young
and your heart was an open book
You used to say live and let live
you know you did
you know you did
you know you did
But if this ever changin
in which we live in
Makes you give in and cry
Say live and let die
Live and let die
What does it matter to ya
When ya got a job to do
Ya got to do it well
You got to give the other fella hell
You used to say live and let live
you know you did
you know you did
you know you did
But if this ever changin
in which we live in
Makes you give in and cry
Say live and let die
Live and let die"
Locomotive	https://www.allthelyrics.com/lyrics/guns_n_roses/locomotive-lyrics-28087.html	Album: Use Your Illusion II	"Gonna find a way to cure this loneliness
Yeah I'll find a way to cure the pain
If I said that you're my friend
And our love would never end
How long before I had your trust again
I opened up the doors when it was cold outside
Hopin' that you'd find your own way in
But how can I protect you
Or try not to neglect you
When you won't take the love I have to give
I bought me an illusion
An I put it on the wall
I let it fill my head with dreams
And I had to have them all
But oh the taste is never so sweet
As what you'd believe it is-
Well I guess it never is
It's these prejudiced illusions
That pump the blood
To the heart of the biz
You know I never thought
That it could take so long
You know I never knew how to be strong
Yeah, I let you shape me
But I feel as though you raped me
'Cause you climbed inside my world
And in my songs
So now I've closed the door
To keep the cold outside
Seems somehow I've found the will to live
But how can I forget you
Or try not to reject you
When we both know it takes time to forgive
Sweetness is a virtue
And you lost your virtue long ago
You know I'd like to hurt you
But my conscience always tells me no
You could sell your body on the street
To anyone whom you might meet
Who'd love to try and get inside
And bust your innocence open wide
'Cause my baby's got a locomotive
My baby's gone off the track
My baby's got a locomotive
Got ta peel the bitch off my back
I know it looks like I'm insane
Take a closer look I'm not to blame
No
Gonna have some fun with my frustration
Gonna watch the big screen in my head
I'd rather take a detour
'Cause this road ain't gettin' clearer
Your train of thought has cut me off again
Better tame that boy 'cause he's a wild one
Better tame that boy for he's a man
Sweetheart don't make me laugh
You's gettin' too big for your pants
And I's think maybe you should
Cut out while you can
You can use you illusion-
Let it take you where it may
We live and learn
And then sometimes it's best to walk away
Me I'm just here hangin' on
It's my only place to stay at least
For now anyway
I've worked too hard for my illusions
Just to throw them all away
I'm taking time for quiet consolation
In passing by this love that's passed away
I know it's never easy-
So why should you believe me
When I've always got so many things to say
Calling off the dogs a simple choice is made
'Cause playful hearts
Can sometimes be enraged
You know I tried to wake you-
I mean how long could it take you
To open up your eyes and turn the page
Kindness is a treasure-
And it's one towards me you've seldom shown
So I'll say it for good measure
To all the ones like you I've known
Ya know I'd like to shave your head
And all my friends could
paint it red
'Cause love to me's a two way street
An all I really want is peace
But my baby's got a locomotive
My baby's gone off the track
My baby's got a locomotive
Got ta peel the bitch off my back
I know it looks like I'm insane
Take a closer look I'm not to blame
No
Affection is a blessing
Can you find it in your sordid heart
I tried to keep this thing
ta-gether
But the tremor tore my pad apart
Yeah I know it's hard to face
When all we've worked for's gone to waste
But you're such a stupid woman
And I'm such a stupid man
But love like time's got its own plans
'Cause my baby's got a locomotive
My baby's gone off the track
My baby's got a locomotive
Got ta peel the bitch off my back
I know it looks like I'm insane
Take a closer look I'm not to blame
Yeah
If love is blind I guess
I'll buy myself a cane
LOVE'S SO STRANGE"
Locomotive Complicity	https://www.allthelyrics.com/lyrics/guns_n_roses/locomotive_complicity-lyrics-505882.html	Album: Use Your Illusion II	"Gonna find a way to cure this loneliness
Yeah I'll find a way to cure the pain
If I said that you're my friend
And our love would never end
How long before I had your trust again
I opened up the doors when it was cold outside
Hopin' that you'd find your own way in
But how can I protect you
Or try not to neglect you
When you won't take the love I have to give
I bought me an illusion
An I put it on the wall
I let it fill my head with dreams
And I had to have them all
But oh the taste is never so sweet
As what you'd believe it is-
Well I guess it never is
It's these prejudiced illusions
That pump the blood
To the heart of the biz
You know I never thought
That it could take so long
You know I never knew how to be strong
Yeah, I let you shape me
But I feel as though you raped me
'Cause you climbed inside my world
And in my songs
So now I've closed the door
To keep the cold outside
Seems somehow I've found the will to live
But how can I forget you
Or try not to reject you
When we both know it takes time to forgive
Sweetness is a virtue
And you lost your virtue long ago
You know I'd like to hurt you
But my conscience always tells me no
You could sell your body on the street
To anyone whom you might meet
Who'd love to try and get inside
And bust your innocence open wide
'Cause my baby's got a locomotive
My baby's gone off the track
My baby's got a locomotive
Got ta peel the ***** off my back
I know it looks like I'm insane
Take a closer look I'm not to blame
No
Gonna have some fun with my frustration
Gonna watch the big screen in my head
I'd rather take a detour
'Cause this road ain't gettin' clearer
Your train of thought has cut me off again
Better tame that boy 'cause he's a wild one
Better tame that boy for he's a man
Sweetheart don't make me laugh
You's gettin' too big for your pants
And I's think maybe you should
Cut out while you can
You can use you illusion-
Let it take you where it may
We live and learn
And then sometimes it's best to walk away
Me I'm just here hangin' on
It's my only place to stay at least
For now anyway
I've worked too hard for my illusions
Just to throw them all away
I'm taking time for quiet consolation
In passing by this love that's passed away
I know it's never easy-
So why should you believe me
When I've always got so many things to say
Calling off the dogs a simple choice is made
'Cause playful hearts
Can sometimes be enraged
You know I tried to wake you-
I mean how long could it take you
To open up your eyes and turn the page
Kindness is a treasure-
And it's one towards me you've seldom shown
So I'll say it for good measure
To all the ones like you I've known
Ya know I'd like to shave your head
And all my friends could paint it red
'Cause love to me's a two way street
An all I really want is peace
But my baby's got a locomotive
My baby's gone off the track
My baby's got a locomotive
Got ta peel the ***** off my back
I know it looks like I'm insane
Take a closer look I'm not to blame
No
Affection is a blessing
Can you find it in your sordid heart
I tried to keep this thing ta-gether
But the tremor tore my pad apart
Yeah I know it's hard to face
When all we've worked for's gone to waste
But you're such a stupid woman
And I'm such a stupid man
But love like time's got its own plans
'Cause my baby's got a locomotive
My baby's gone off the track
My baby's got a locomotive
Got ta peel the ***** off my back
I know it looks like I'm insane
Take a closer look I'm not to blame
Yeah
If love is blind I guess I'll buy myself a cane"
Look At Your Game, Girl	https://www.allthelyrics.com/lyrics/guns_n_roses/look_at_your_game_girl-lyrics-28105.html	Album: The Spaghetti Incident?	"There's a time for living
Time keeps on flying
Think you're loving baby
But all your doing is crying
[CHORUS:]
Can you feel
Are those feelings real
Look at your game, girl
Look at your game, girl
What a mad delusion
Living in that confusion
Frustration and doubt
Can you ever live without the game
The sad, sad game
Mad game
Just to say loves' not enough
If it can't be true
Oh, you can tell those lies baby but you're only fooling you
[CHORUS]
Can you feel
I know those feelings ain't real
Then you better stop trying
Or you're gonna play crying
Stop trying
Or you're gonna play crying
Stop trying
That's the game
Sad sad game
Mad game
Sad game
[spoken]
Thanks, Chas
Jack"
Love Sucks(played On New Tour)	https://www.allthelyrics.com/lyrics/guns_n_roses/love_sucksplayed_on_new_tour-lyrics-505881.html	Album: Singles	"Love Sucks, ya you know it sux...
All your friends are gay
I hate them any way
Love Sucks, ya you know it sux...
I've tried it once
I won't try it again
Love Sucks, ya you know it sux...
Love Sucks Love Sucks Love Sucks
Love Sucks, ya you know it sux...
Love Sucks, ya you know it sux...
Why can't love make sense?....(fades away)"
Madagascar	https://www.allthelyrics.com/lyrics/guns_n_roses/madagascar-lyrics-28108.html	Album: Chinese Democracy	"I won't be told anymore
That I've been brought down in this storm
And left so far out from the shore
That I can't find my way back, my way anymore
No I won't be told anymore
That I've been brought back in this storm
And left so far out from the shore
That I can't find my way back, my way anymore
No, I..
No, I...
Forgive that they teared down my soul
Bless them that they might grow old
A dream that's forgotten may know
That it's never too late
So many times that I've seen life before me
I searched and found the way to choose to the end
I found a way, to know, why it had to be
Mired in denial and saw all the rain
If we ever find it true
Love will have its way to choose
Three more to tame
We can be ever
I won't be told anymore
That I've been brought down in this storm
And left so far out from the shore
And I can't find my way back, my way anymore
No I won't be told anymore
That I've been brought back in this storm
And left so far out from the shore
That I can't find my way back, my way anymore"
Mama Kin	https://www.allthelyrics.com/lyrics/guns_n_roses/mama_kin-lyrics-28042.html	Album: Live Like A Suicide	"It ain't easy livin' like a gypsy
Tell ya, honey, how it feels
I've been dreamin' floatin' down stream
And losin' touch with all that's real
Whole lotta lover, keepin' undercover
Never knowin' where you been-Oo yeah
You've been fadin', always out paradin'
Keep in touch with mama kin!
You always got your tail on the wag
Spittin' fire from your mouth
Just like a dragon
You act like a perpetual drag
You better check it out
'Cause someday soon
You'll have to climb back on the wagon
It ain't easy livin' like you wanna
It's so hard to find piece of mind
Yes it is
The way I see it
You got to say 'shee-it'
But don't forget to drop me a line
Bald as an egg at eighteen
And workin' for daddy's such a drag
You still stuff your mouth
With his beans
You better check it out or someday soon
You'll have to climb back on the wagon
Keep in touch with mama kin
Tell her where you gone and been
Livin' out your fantasy
Sleepin' late and smokin' tea
Keep in touch with mama kin
Tell her where you gone and been
Livin' out your fantasy
Sleepin' late and suckin' me, oh no
It ain't easy livin' like you wanna
It's so hard to find piece of mind
Yes it is
The way I see it
You got to say 'shee-it'
But don't forget to drop me a line
Bald as an egg at eighteen
And workin' for daddy's just a drag
You still stuff your mouth
With his beans
You better check it out or someday soon
You'll have to climb back on the wagon
Keep in touch with mama kin
Tell her where you gone and been
Livin' out your fantasy
Sleepin' late and smokin' tea
Keep in touch with mama kin
Tell her where you gone and been
Livin' out your fantasy
Sleepin' late and suckin' me
Ohh, ow, ow, ow, yeah! -ow"
Move To The City	https://www.allthelyrics.com/lyrics/guns_n_roses/move_to_the_city-lyrics-28041.html	Album: Live Like A Suicide	"You pack your bags
And you move to the city
There's somethin' missin' here at home
You fix your hair
And you're lookin' real pretty
It's time to get it out on your own
You're always fightin'
With your mama and you papa
Your family life is one big pain!
When you, you gonna move to the city?
Into the city where it all began
You gotta move
You gotta move
Ma, ma, ma, ma, ma, ma, ma, ma, ma
Time you gotta move
You stole your mama's car
And your daddy's plastic credit card
You're sixteen and you can't get a job
You're not goin' very far
You're always ridin'
With the teachers and the police
This life is much too insane!
When you, you gonna move to the city?
Into the city where it all began
You gotta move
You gotta move
Ma, ma, ma, ma, ma, ma, ma, ma, ma
Time you gotta move
Right to the city
Where the real men get it
Aw, child, ain't it a pity?
Sometimes it gets too shitty!
Come on and hit me!
You're on the streets
And it ain't so pretty
You need to get a new what you please
You do what you gotta do for the money
At times you end up on your knees!
I'm always buyin'
With the local and the junkies
This city life is one big pain!
But you, you had to move to the city
Into the city where it all began
You gotta move
You gotta move
Ma, ma, ma, ma, ma, ma, ma, ma, ma
Time you gotta move
Oh right to the city
With the real nitty gritty
Aw, child, ain't it a pity?
Sometimes it gets too shitty!
Come on and hit me!"
Mr. Brownstone	https://www.allthelyrics.com/lyrics/guns_n_roses/mr_brownstone-lyrics-28047.html	Album: Appetite For Destruction	"I get up around seven
Get outta bed around nine
And I don't worry about nothin' no
Cause worryin's a waste of my time
The show usually starts around seven
We go on stage around nine
Get on the bus about eleven
Sippin' a drink and feelin' fine
We been dancin' with
Mr. Brownstone
He's been knockin'
He won't leave me alone
I used ta do a little
but a little wouldn't do it
So the little got more and more
I just keep tryin'
ta get a little better
Said a little better than before
I used ta do a little
but a little wouldn't do it
So the little got more and more
I just keep tryin'
ta get a little better
Said a little better than before
We been dancin' with
Mr. Brownstone
He's been knockin'
He won't leave me alone
No, No, No, He won't leave me alone
Now I get up around whenever
I used ta get up on time
But that old man
he's a real muthafucker
Gonna kick him on down the line
I used ta do a little
but a little wouldn't do it
So the little got more and more
I just keep tryin'
ta get a little better
Said a little better than before
I used ta do a little
but a little wouldn't do it
So the little got more and more
I just keep tryin'
ta get a little better
Said a little better than before
We been dancin' with
Mr. Brownstone
He's been knockin'
He won't leave me alone
No, No, No, he won't leave me alone
He won't leave me alone
Stuck it in the middle, and I
Shout it in the middle, and I
It drove me out of my mind
Shoulda known better, said
I wish I never met her, said I
I leave it all behind"
