song	link	album	lyrics
In Chains	https://www.allthelyrics.com/lyrics/depeche_mode/in_chains-lyrics-1306081.html	Album: Sounds Of The Universe	"The way you move
Has got me yearning
The way you move
Has left me burning
I know you know what you're doing to me
I know my hands will never be free
I know what it's like to be
In chains
The way you move
Is meant to haunt me
The way you move
To tempt and taunt me
I know you knew on the day you were born
I know somehow I should've been warned
I know I walk every midnight to dawn
In Chains
In chains, I'm in chains
In chains, I'm in chains
You've got me dying for you
Its you that I'm living through
You've got me praying to you
Saying to you anything you want me to
You've got me reaching for you
My souls beseeching me too
You've got me singing to you
Bringing to you anything you ask me to
The way you move
Is mesmerizing
The way you move
Is hypnotizing
I know I crumble when you are around
Start to mumble a bit of a false sound
Straggle, stumble, shackled and bound
In chains
In chains, I'm in chains
In chains, I'm in chains
You've got me dying for you
Its you that I'm living through
You've got me praying to you
Saying to you anything you want me to
You've got me reaching for you
My souls beseeching me too
You've got me singing to you
Bringing to you anything you ask me to
I'm in chains
In chains, I'm in chains
In chains, I'm in chains
In chains, I'm in chains"
In Sympathy	https://www.allthelyrics.com/lyrics/depeche_mode/in_sympathy-lyrics-1306085.html	Album: Sounds Of The Universe	"They're almost falling over you
Why don't they call a truce
What ever they are trying to do
Its of little use
They're drowning you in compliments
Trying to furnish proof
Although they speak with eloquence
There is little truth
You're bright, you're strong, you know the right from wrong
At least to some degree
You're wise, you're tough, you've heard their lies enough
You smile in sympathy
I'm watching your serenity
The way your so transense
The tidiest absurdities
Your patience never ends
And as the night begins to fade
Your heading for the door
Followed by sad parade
Your on your own once more
You're bright, you're strong, you know the right from wrong
At least to some degree
You're wise, you're tough, you've heard their lies enough
You smile in sympathy
You're bright, you're strong, you know the right from wrong
At least to some degree
You're wise, you're tough, you've heard their lies enough
You smile in sympathy"
In Your Memory	https://www.allthelyrics.com/lyrics/depeche_mode/in_your_memory-lyrics-46380.html	Album: A Broken Frame	"Put up the barriers
Shut down your senses
Cover up with all of your pretences
See no evil
Your eyes are blunted
We are the hunters
We are the hunted
Place it in your memory
Leave it in your past
But don't forget
Taking a tumble
I'm taking a dive
Sometimes I stumble when my mind's made up
Reaction levels
Seem strangely muted
Ordinary acts of fun have been diluted
Place it in your memory
Leave it in your past
But don't forget"
In Your Room	https://www.allthelyrics.com/lyrics/depeche_mode/in_your_room-lyrics-46526.html	Album: The Singles 86>98	"In your room
Where time stands still
Or moves at your will
Will you let the morning come soon
Or will you leave me lying here
In your favourite darkness
Your favourite half-light
Your favourite consciousness
Your favourite slave
In your room
Where souls disappear
Only you exist here
Will you lead me to your armchair
Or leave me lying here
Your favourite innocence
Your favourite prize
Your favourite smile
Your favourite slave
I'm hanging on your words
Living on your breath
Feeling with your skin
Will I always be here
In your room
Your burning eyes
Cause flames to arise
Will you let the fire die down soon
Or will I always be here
Your favourite passion
Your favourite game
Your favourite mirror
Your favourite slave
I'm hanging on your words
Living on your breath
Feeling with your skin
Will I always be here
Will I always be here"
Insight	https://www.allthelyrics.com/lyrics/depeche_mode/insight-lyrics-46537.html	Album: Disc 1	"This is an insight
Into my life
This is a strange flight
I'm taking
My true will
Carries me along
This is a soul dance
Embracing me
This is the first chance
To put things right
Moving on
Guided by the light
And the spirit of love
Is rising within me
Talking to you now
Telling you clearly
The fire still burns
Wisdom of ages
Rush over me
Heighten my senses
Enlighten me
Lead me on
Eternally
And the spirit of love
Is rising within me
Talking to you now
Telling you clearly
The fire still burns
I'm talking to you now
The fire still burns
Whatever you do now
You've got to give love
The world still turns
I'm talking to you now"
It Doesn't Matter	https://www.allthelyrics.com/lyrics/depeche_mode/it_doesnt_matter-lyrics-46456.html	Album: Black Celebration	"As I lay here with you
The shame lies with us
We talk of love and trust
That doesn't matter
Though we may be the last in the world
We feel like pioneers
Telling hopes and fears
To one another
And oh what a feeling
Inside of me
It might last for an hour
Wounds aren't healing
Inside of me
Though it feels good now
I know it's only for now
The feeling is intense
You grip me with your eyes
And then I realise
It doesn't matter"
It's Called A Heart	https://www.allthelyrics.com/lyrics/depeche_mode/its_called_a_heart-lyrics-46364.html	Album: The Singles 81>85	"There's something beating here inside my body
And it's called a heart
You know how easy it is
To tear it apart
If I lend it to you
Will you keep it safe for me
I'll lend it to you
If you treat it tenderly
There's something beating here inside my body
And it's called a heart
There's a sun shining in the sky
But that's not the reason why
I'm feeling warm inside
The answer isn't classified, it's my heart
From the moment I started
I tried to be goodhearted
Yes I tried my best
And more or less
I spoke from my heart
There's a lot to be learnt
And you learn when you heart gets burnt
Hearts could never be owned
Hearts only come on loan
If I want it back
I will take it back, I'll take my heart
But I will try my best and more or less
I will speak from my heart
Yes I will speak from my heart
Speak from my heart"
It's No Good	https://www.allthelyrics.com/lyrics/depeche_mode/its_no_good-lyrics-46543.html	Album: The Singles 86>98	"Im going to take my timeI have all the time in the world
To make you mine
It is written in the stars above
The gods decree
Youll be right here by my side
Right next to me
You can run, but you can not hide
Dont say you want me
Dont say you need me
Dont say you love me
Its understood
Dont say youre happy
Out there without me
I know you cant be
`Cause its no good
Ill be fine
Ill be be waiting patiently
Till you see the signs
And come running to my open arms
When will you realize
Do we have to wait till our worlds collide
Open up your eyes
You cant turn back the tide
Dont say you want me
Dont say you need me
Dont say you love me
Its understood
Dont say youre happy
Out there without me
I know you cant be
`Cause its no good
Im going to take my timeI have all the time in the world
To make you mine
It is written in the stars above"
Jezebel	https://www.allthelyrics.com/lyrics/depeche_mode/jezebel-lyrics-1306090.html	Album: Sounds Of The Universe	"They call you Jezebel
Whenever we walk in
You're going straight to hell
For wanted acts of sin - they say,
And that I'll have to pay
But I need you just this way
They call you Jezebel
For what you like to wear
You're morally unwell
They say you never care for me
But what the fail to see is that your games are the key
Open their eyes to the beauty
Open their hearts to the fun
Open their minds to the idea that you don't own someone
They call you Jezebel
Whenever men walk by
They say that they can tell
The longing in your eyes is real
And how you really feel
But they can't see your appeal
Jezebel"
Judas	https://www.allthelyrics.com/lyrics/depeche_mode/judas-lyrics-46528.html	Album: Ultra	"Is simplicity best
Or simply the easiest
The narrowest path
Is always the holiest
So walk on barefoot for me
Suffer some misery
If you want my love
If you want my love
Man will survive
The harshest conditions
And stay alive
Through difficult decisions
So make up your mind for me
Walk the line for me
If you want my love
If you want my love
Idle talk
And hollow promises
Cheating Judases
Doubting Thomases
Don't just stand there and shout it
Do something about it
You can fulfill
Your wildest ambitions
And I'm sure you will
Lose your inhibitions
So open yourself for me
Risk your health for me
If you want my love
If you want my love
If you want my love
If you want my love"
Just Can't Get Enough	https://www.allthelyrics.com/lyrics/depeche_mode/just_cant_get_enough-lyrics-46388.html	Album: The Singles 81>85	"When I'm with you baby
I go out of my head
And I just can't get enough
And I just can't get enough
All the things you do to me
And everything you said
I just can't get enough
I just can't get enough
We slip and slide as we fall in love
And I just can't seem to get enough of
We walk together
We're walking down the street
And I just can't get enough
And I just can't get enough
Every time I think of you
I know we have to meet
And I just can't get enough
I just can't get enough
It's getting hotter
It's a burning love
And I just can't seem to get enough of
And when it rains
You're shining down for me
And I just can't get enough
And I just can't get enough
Just like a rainbow
You know you set me free
And I just can't get enough
And I just can't get enough
You're like an angel
And you give me your love
And I just can't seem to get enough of"
Ka-ching	https://www.allthelyrics.com/lyrics/depeche_mode/kaching-lyrics-127641.html	-	"""Ka-Ching""
We live in a greedy little world--
that teaches every little boy and girl
To earn as much as they can possibly--
then turn around and
Spend it foolishly
We've created us a credit card mess
We spend the money we don't possess
Our religion is to go and blow it all
So it's shoppin' every Sunday at the mall
All we ever want is more
A lot more than we had before
So take me to the nearest store
[Chorus:]
Can you hear it ring
It makes you wanna sing
It's such a beautiful thing--Ka-ching!
Lots of diamond rings
The happiness it brings
You'll live like a king
With lots of money and things
When you're broke go and get a loan
Take out another mortgage on your home
Consolidate so you can afford
To go and spend some more when
you get bored
All we ever want is more
A lot more than we had before
So take me to the nearest store
[Repeat Chorus]
Let's swing
Dig deeper in your pocket
Oh, yeah, ha
Come on I know you've got it
Dig deeper in your wallet
Oh
All we ever want is more
A lot more than we had before
So take me to the nearest store
[Repeat Chorus]
Can you hear it ring
It makes you wanna sing
You'll live like a king
With lots of money and things
Ka-ching!"
Ka-ching - Shania Twain	https://www.allthelyrics.com/lyrics/depeche_mode/kaching_shania_twain-lyrics-127642.html	-	"""Ka-Ching""
We live in a greedy little world--
that teaches every little boy and girl
To earn as much as they can possibly--
then turn around and
Spend it foolishly
We've created us a credit card mess
We spend the money we don't possess
Our religion is to go and blow it all
So it's shoppin' every Sunday at the mall
All we ever want is more
A lot more than we had before
So take me to the nearest store
[Chorus:]
Can you hear it ring
It makes you wanna sing
It's such a beautiful thing--Ka-ching!
Lots of diamond rings
The happiness it brings
You'll live like a king
With lots of money and things
When you're broke go and get a loan
Take out another mortgage on your home
Consolidate so you can afford
To go and spend some more when
you get bored
All we ever want is more
A lot more than we had before
So take me to the nearest store
[Repeat Chorus]
Let's swing
Dig deeper in your pocket
Oh, yeah, ha
Come on I know you've got it
Dig deeper in your wallet
Oh
All we ever want is more
A lot more than we had before
So take me to the nearest store
[Repeat Chorus]
Can you hear it ring
It makes you wanna sing
You'll live like a king
With lots of money and things
Ka-ching!"
Leave In Silence	https://www.allthelyrics.com/lyrics/depeche_mode/leave_in_silence-lyrics-46419.html	Album: The Singles 81>85	"I've told myself so many times before
But this time I think I mean it for sure
We have reached a full stop
Nothing's going to save us from the big drop
Reached our natural conclusion
Outlived the illusion
I hate being in these situations
That call for diplomatic relations
If I only knew the answer
Or I thought we had a chance
Or I could stop this
I would stop this thing
From spreading like a cancer
What can I say
I don't want to play anymore
What can I say
I'm heading for the door
I can't stand this emotional violence
Leave in silence
Leave in silence
We've been running around in circles all year
Doing this and that and getting nowhere
This will be the last time
I think I said that last time
If I only had a potion
Some magical lotion
That could stop this
I would set the wheels in motion"
Lie To Me	https://www.allthelyrics.com/lyrics/depeche_mode/lie_to_me-lyrics-46462.html	Album: Black Celebration	"Come on and lay with me
Come on and lie to me
Tell me you love me
Say I'm the only one
Experiences have a lasting impression
But words once spoken
Don't mean a lot now
Belief is the way
The way of the innocent
And when I say innocent
I should say naive
So lie to me
But do it with sincerity
Make me listen
Just for a minute
Make me think
There's some truth in it
Promises made for convenience
Aren't necessarily
What we need
Truth is a word
That's lost its meaning
The truth has become
Merely half-truth
So lie to me
Like they do it in the factory
Make me think
That at the end of the day
Some great reward
Will be coming my way"
Light	https://www.allthelyrics.com/lyrics/depeche_mode/light-lyrics-1307336.html	Album: Sounds Of The Universe	"Take my hand
And walk in the light
Understand, there's a fire to ignite
You know we have a responsibility
It's true we've been chosen
And now we have the possibility
Of melting what's frozen
Walk with me with the rapture inside
Can't you see it's not our place to decide
You know we have to make a case for love
It's more of a duty
It's clear we have a mission from above
A mission of beauty
You know I wouldn't lie to you
What would I achieve by that
It's more than I would try to do
These are the facts
Take your place here
With love in your heart
Just embrace what you've known from the start
We are fulfilling our only destiny
The angels have spoken
And all the gods in the universe agree
The spell can't be broken"
Little 15	https://www.allthelyrics.com/lyrics/depeche_mode/little_15-lyrics-46494.html	Album: 101	"Little fifteen
You help her forget
The world outside
You're not part of it yet
And if you could drive
You could drive her away
To a happier place
To a happier day
That exists in your mind
And in your smile
She could escape there
Just for a while
Little fifteen
Little fifteen
Why take the smooth with the rough
When things run smooth
It's already more than enough
She knows your mind
Is not yet in league
With the rest of the world
And its little intrigues
Do you understand
Do you know what she means
As time goes by
And when you've seen what she's seen
you will
Little fifteen
Little fifteen
Why does she have to defend
Her feelings inside
Why pretend
She's not had a life
A life of near misses
Now all that she wants
Is three little wishes
She wants to see with your eyes
She wants to smile with your smile
She wants a nice surprise
Every once in a while
She wants to see with your eyes
She wants to smile with your smile
She wants a nice surprise
Every once in a while
Little fifteen"
Little Soul	https://www.allthelyrics.com/lyrics/depeche_mode/little_soul-lyrics-1306084.html	Album: Sounds Of The Universe	"My little light
Is going to shine
Shine out so bright
And illuminate your mind
My little soul
Will leave a footprint
This little voice
Is going to sing
I have no choice
It will infinitely ring
My little soul
Will leave a footprint
I'm channeling the universe
It's focusing its love inside of me
A Singularity
My little words
Are going to sting
Haven't you heard
The pain and joy they bring
My little soul
Will leave a footprint
I'm channeling the universe
It's focusing its love inside of me
A singularity
Your little eyes
They're going to see
I can't disguise
The beauty inside me
My little soul
Will leave a footprint"
Love, In Itself	https://www.allthelyrics.com/lyrics/depeche_mode/love_in_itself-lyrics-46438.html	Album: The Singles 81>85	"All of these insurmountable tasks
That lay before me
All of the firsts
And the definite lasts
That lay in store for me
There was a time
When all on my mind was love
Now I find
That most of the time
Love's not enough
In itself
Consequently
I've a tendency
To be unhappy, you see
The thoughts in my head
All the words that were said
All the blues and the reds
Get to me
All of the absurdities
That lay before us
All of the doubts
And the uncertainties
That lay in store for us"
Master And Servant	https://www.allthelyrics.com/lyrics/depeche_mode/master_and_servant-lyrics-46446.html	Album: The Singles 81>85	"There's a new game
We like to play you see
A game with added reality
You treat me like a dog
Get me down on my knees
We call it master and servant
We call it master and servant
It's a lot like life
This play between the sheets
With you on top and me underneath
Forget all about equality
Let's play master and servant
Let's play master and servant
It's a lot like life
And that's what's appealing
If you despise that throwaway feeling
From disposable fun
Then this is the one
Domination's the name of the game
In bed or in life
They're both just the same
Except in one you're fulfilled
At the end of the day
Let's play master and servant
Let's play master and servant
Let's play master and servant
Come on master and servant"
Mercy In You	https://www.allthelyrics.com/lyrics/depeche_mode/mercy_in_you-lyrics-46529.html	Album: Ultra	"You know what I need
When my heart bleeds
I suffer from greed
A longing to feed
On the mercy in you
I can't conceal
The way I'm healed
The pleasure I feel
When I have to deal
With the mercy in you
I would do it all again
Lose my way and fall again
Just so I could call again
On the mercy in you
When here in my mind
I feel inclined
To wrongly treat you unkind
I have faith I will find
The mercy in you
I would lose my way again
Be led hopelessly astray again
Just so I could pray again
For the mercy in you
When here in my mind
I have been blind
Emotionally behind
I have faith I will find
The mercy in you"
Miles Away / The Truth Is	https://www.allthelyrics.com/lyrics/depeche_mode/miles_away_the_truth_is-lyrics-1306089.html	Album: Sounds Of The Universe	"It's one of those conversations
We've we've had them before
The ones that leave you empty
And wanting for more
Your eyes they tell me something
That I understand
Your eyes they hold the truth
And the truth is:
You're miles away 3x
Excuse me for my hesitation
'ave i met you before
Your face seems so familiar
And longing for more
Your eyes they tell me something
That i understand
Your eyes they hold the truth
And a truth is
You're miles away
With all your superstitions
And empty lines
I could be just like you
Withdrawn but alive
Life it has its limitations
We all have our needs
Love could be the only answer
It lies underneath
Your eyes they tell me something
That i understand
Your eyes they hold the truth
And a truth is
You're miles away"
Monument	https://www.allthelyrics.com/lyrics/depeche_mode/monument-lyrics-46416.html	Album: People Are People	"When the site was found
We laid the foundations down
It didn't take long before
They came back tumbling down
Don't build at night
You need a little light
How else are you going to see
What it is going to be like
So we picked up our tools
And we worked in the morning light
With the last stone placed
Wasn't it a wonderful site
But it fell back down
And scattered all around
Anything passes
When you need glasses
My monument
It feel down
My monument
It feel down
Work all of my days for this kind of praise
It fell down
Work all of my days
It fell down"
More Than A Party	https://www.allthelyrics.com/lyrics/depeche_mode/more_than_a_party-lyrics-46436.html	Album: Some Great Reward	"Lots of surprises in store
This isn't a party
It's a whole lot more
We've had enough of this blind man's bluff
You've kept us in the dark for long enough
This is more than a party
More than a party
More than a party
Keep telling us we're to have fun
Then take all the ice cream so we've got none
The failed magician waves his wand
And in an instant the laughter's gone
Loads of surprises in store
This isn't a party
It's a whole lot more"
Motherless Child	https://www.allthelyrics.com/lyrics/depeche_mode/motherless_child-lyrics-440723.html	Album: Speak Spell	"Sometimes I feel like a motherless child
Sometimes I feel like a motherless child
Sometimes I feel like a motherless child
Sometimes I feel like a motherless child
A long way from home
A long way from home
True believer
A long way from home
A long way from home"
Music For The Masses	https://www.allthelyrics.com/lyrics/depeche_mode/music_for_the_masses-lyrics-515848.html	-	"Lots of surprises in store
This isn't a party
It's a whole lot more
We've had enough of this blind man's buff
You've kept us in the dark for long enough
This is more than a party
More than a party
More than a party
Keep telling us we're to have fun
Then take all the ice-cream so we've got none
The failed magician waves his wand
And in an instant the laughter's gone
This is more then a party
More than a party
More than a party
Lots of surprises in store
This isn't a party
It's a whole lot more
More than a party."
My Joy	https://www.allthelyrics.com/lyrics/depeche_mode/my_joy-lyrics-46379.html	Album: A Broken Frame	"My joy
The air that I breathe
My joy
In god I believe
My joy
You move me
My joy
The blood in my veins
My joy
Flows in your name
My joy
You move me
I'm not a mountain, no
You move me
My joy
Heavenly bliss
My joy
The pleasures I've missed
My joy
You move me
I'm not a mountain, no
You move me"
My Secret Garden	https://www.allthelyrics.com/lyrics/depeche_mode/my_secret_garden-lyrics-46418.html	Album: People Are People	"My secret garden's not so secret anymore
Run from the house holding my head in my hands
Feeling dejected, feeling like a child might feel
It all seems so absurd
That this should have occurred
My very only secret
And I had to go and leak it!
My secret garden's not so secret anymore!
No, my secret garden's not so secret anymore!
Run through the fields, down to the edge of the water
Can't stay long, here comes the reason why -
She'll catch me if she can,
Take me by the hand
I'll have to keep on running
And I just can't see the fun in
My secret garden not being secret anymore!
It used to be so easy
On days such as these she'd
Search and search for hours
In among the flowers
I loved it! - I loved her!
Play the fool, act so cruel - I loved it!
Read her book, take a look - I loved her!
It all seems so absurd
That this should have occurred
My very only secret
And I had to go and leak it!
My secret garden's not so secret anymore!"
Never Let Me Down Again	https://www.allthelyrics.com/lyrics/depeche_mode/never_let_me_down_again-lyrics-46504.html	Album: The Singles 86>98	"I'm taking a ride
With my best friend
I hope he never lets me down again
He knows where he's taking me
Taking me where I want to be
I'm taking a ride
With my best friend
We're flying high
We're watching the world pass us by
Never want to come down
Never want to put my feet back down
On the ground
I'm taking a ride
With my best friend
I hope he never lets me down again
Promises me I'm safe as houses
As long as I remember who's wearing the trousers
I hope he never lets me down again
Never let me down
See the stars, they're shining bright
Everything's alright tonight"
Never Turn Your Back On Mother Earth	https://www.allthelyrics.com/lyrics/depeche_mode/never_turn_your_back_on_mother_earth-lyrics-440722.html	Album: Speak Spell	"When she's on her best behaiviour
Don't be tempted by her favours
Never turn your back on mother earth
Towns are hurled from A to B
By hands that looked so smooth to me
Never turn your back on mother earth
Grasp at straws that don't want grasping
Gaze at clouds that come down crashing
Never turn your back on mother earth
Three days and two nights away from my friends
Amen to anything that brings a quick return
To my friends
To my friends
Never turn your back on mother earth
I'll admit I was unfaithful
But from now I'll be more faithful
Never turn your back on mother
Never turn your back on mother
Never turn your back on mother earth"
New Dress	https://www.allthelyrics.com/lyrics/depeche_mode/new_dress-lyrics-46465.html	Album: Music For The Masses	"Sex jibe husband murders wife
Bomb blast victim fights for life
Girl Thirteen attacked with knife
Princess Di is wearing a new dress
Jet airliner shot from sky
Famine horror, millions die
Earthquake terror figures rise
Princess Di is wearing a new dress
You can't change the world
But you can change the facts
And when you change the facts
You change points of view
If you change points of view
You may change a vote
And when you change a vote
You may change the world
In black townships fires blaze
Prospects better premier says
Within sight are golden days
Princess Di is wearing a new dress
You can't change the world
But you can change the facts
And when you change the facts
You change points of view
If you change points of view
You may change a vote
And when you change a vote
You may change the world
Princess Di is wearing a new dress"
