song	link	album	lyrics
Dressed In Black	https://www.allthelyrics.com/lyrics/depeche_mode/dressed_in_black-lyrics-46466.html	Album: Music For The Masses	"She's dressed in black again
And I'm falling down again
Down to the floor again
I'm begging for more again
But oh what can you do
When she's dressed in black
My mind wanders endlessly
On paths where she's leading me
With games that she likes to play
And words that she doesn't say
Not when whe're alone
And she's dressed in black
As a picture of herself
She's a picture of the world
A reflection of you
A reflection of me
And it's all there to see
If you only give in
To the fire within
Dressed in black again
Shadows fall onto me
As she stands there over me
And waits to encompass me
I lay here helplessly
But oh what can you do
When she's dressed in black
Dressed in black again"
Enjoy The Silence	https://www.allthelyrics.com/lyrics/depeche_mode/enjoy_the_silence-lyrics-46511.html	Album: The Singles 86>98	"Words like violence
Break the silence
Come crashing in
Into my little world
Painful to me
Pierce right through me
Can't you understand
Oh my little girl
All I ever wanted
All I ever needed
Is here in my arms
Words are very unnecessary
They can only do harm
Vows are spoken
To be broken
Feelings are intense
Words are trivial
Pleasures remain
So does the pain
Words are meaningless
And forgettable
All I ever wanted
All I ever needed
Is here in my arms
Words are very unnecessary
They can only do harm"
Everything Counts	https://www.allthelyrics.com/lyrics/depeche_mode/everything_counts-lyrics-46429.html	Album: The Singles 81>85	"The handshake seals the contract
From the contract there's no turning back
The turning point of a career
In Korea being insincere
The holiday was fun-packed
The contract, still intact
The grabbing hands grab all they can
All for themselves - after all
The grabbing hands grab all they can
All for themselves - after all
It's a competitive world
Everything counts in large amounts
The graph on the wall
Tells the story of it all
Picture it now see just how
The lies and deceit gained a little more power
Confidence - taken in
By a suntan and a grin
The grabbing hands grab all they can
All for themselves - after all
The grabbing hands grab all they can
All for themselves - after all
It's a competitive world
Everything counts in large amounts
The grabbing hands grab all they can
Everything counts in large amounts"
Everything Counts (Long Version)	https://www.allthelyrics.com/lyrics/depeche_mode/everything_counts_long_version-lyrics-1145501.html	Album: Best Of Depeche Mode	"The handshake seals the contract
From the contract there's no turning back
The turning point of a career
In Korea being insincere
The holiday was fun-packed
The contract, still intact
The grabbing hands grab all they can
All for themselves - after all
The grabbing hands grab all they can
All for themselves - after all
It's a competitive world
Everything counts in large amounts
The graph on the wall
Tells the story of it all
Picture it now see just how
The lies and deceit gained a little more power
Confidence - taken in
By a suntan and a grin
The grabbing hands grab all they can
All for themselves - after all
The grabbing hands grab all they can
All for themselves - after all
It's a competitive world
Everything counts in large amounts
The grabbing hands grab all they can
Everything counts in large amounts"
Flexible	https://www.allthelyrics.com/lyrics/depeche_mode/flexible-lyrics-46367.html	Album: Disc 1	"Fame
Can have strange effects
Money
Can have strange effects
I ask myself
Is it a sin
To be flexible
When the boat comes in
Open the window and out go ideals
Drink
Can alter you
Girls
Can have strange effects, too
We all know boats don't last
We all know cars are fast"
Fly On The Windscreen	https://www.allthelyrics.com/lyrics/depeche_mode/fly_on_the_windscreen-lyrics-46482.html	Album: Music For The Masses	"Death is everywhere
There are flies on the windscreen
For a start
Reminding us
We could be torn apart
Tonight
Death is everywhere
There are lambs for the slaughter
Waiting to die
And I can sense
The hours slipping by
Tonight
Come here
Kiss me
Now
Come here
Kiss me
Now
Death is everywhere
The more I look
The more I see
The more I feel
A sense of urgency
Tonight
Come here
Touch me
Kiss me
Touch me
Now
Touch me
Touch me
There are flies on the windscreen
There are lambs for the slaughter
There are flies on the windscreen
Come here
Touch me
Kiss me
Touch me
Now
Touch me
Touch me"
Fools	https://www.allthelyrics.com/lyrics/depeche_mode/fools-lyrics-46382.html	Album: A Broken Frame	"Don't know the reason why I
Think I've been here before
This place seems so familiar
But then I can't be sure
Here comes that time again when
You'll walk right out the door
Don't tell me secrets anymore
And fools don't run away
You'll be followed another day
And all the chances that fall your way
Are in the fire on your dying day
So call me now and tell me that you're home
Can't see the sense in crying
There's too many tears to fall
My thoughts are multiplying
So I'll try to save them all"
Fragile Tension	https://www.allthelyrics.com/lyrics/depeche_mode/fragile_tension-lyrics-1306083.html	Album: Sounds Of The Universe	"There's a fragile tension,
That's keeping us going
It may not last forever,
But oh well it's blowing
There's something magical in the air
Something so tragic we had to care
There's a strange obsession,
That's drawing us nearer
We don't understand it
It never gets clearer
There's something mystical in our dreams
So simplistic it kicks and screams
All we will seem to reek on the edge of collapse
Nothing can keep us down
There's a dizzying feeling,
That's keeping us flying
Some glittering gauntlet
Without even trying
There's something radical in our hands
Nothing logical to our plans"
Freelove	https://www.allthelyrics.com/lyrics/depeche_mode/freelove-lyrics-33726.html	Album: Exciter	"If you've been hiding from love
If you've been hiding from love
I can understand where you're coming from
I can understand where you're coming from
If you've suffered enough
If you've suffered enough
I can understand what you're thinking of
I can see the pain that you're frightened of
And I'm only here
To bring you free love
Let's make it clear
That this is free love
No hidden catch
No strings attached
Just free love
No hidden catch
No strings attached
Just free love
I've been running like you
I've been running like you
Now you understand why I'm running scared
Now you understand why I'm running scared
I've been searching for truth
I've been searching for truth
And I haven't been getting anywhere
No I haven't been getting anywhere
And I'm only here
To bring you free love
Let's make it clear
That this is free love
No hidden catch
No strings attached
Just free love
No hidden catch
No strings attached
Just free love
Hey girl
You've got to take this moment
Then let it slip away
Let go of complicated feelings
Then there's no price to pay
We've been running from love
We've been running from love
And we don't know what we're doing here
No we don't know what we're doing here
We're only here
Sharing our free love
Let's make it clear
That this is free love
No hidden catch
No strings attached
Just free love
No hidden catch
No strings attached
Just free love"
Freestate	https://www.allthelyrics.com/lyrics/depeche_mode/freestate-lyrics-46539.html	Album: Disc 1	"I can hear your soul crying
Listen to your spirit sighing
I can feel your desperation
Emotional deprivation
Let yourself go
Let yourself go
Let your feelings show
Picking up the conversation
Deep in your imagination
Tune into the lonely voices
Talking of their only choices
Let yourself go
Let yourself go
Let your spirit grow
Step out of your cage
And onto the stage
It's time to start
Playing your part
Freedom awaits
Open the gates
Open your mind
Freedom's a state
I can taste the tears falling
The bitterness inside you calling
Yearning for a liberation
Emotional emancipation
Let yourself go
Let yourself go
Let your senses overflow
Step out of your cage
And onto the stage
It's time to start
Playing your part
Freedom awaits
Open the gates
Open your mind
Freedom's a state"
Get Right With Me	https://www.allthelyrics.com/lyrics/depeche_mode/get_right_with_me-lyrics-46525.html	Album: Ultra	"I will have faith in man
That is hard to understand
Show some humility
You have the ability
Get right with me
Friends, if you´ve lost your way
You will find it again some day
Come down from you pedestals
And open your mouths that´s all
Get Right with me
Life is such a short thing
Thats I cannot comprehend
But if this life were a
bought thing
There are ways I know
we´d mend
People, take my advice
Already told you once, once
or twice
Donn´t wast your energy
Making apologies
Get right with me"
Get The Balance Right	https://www.allthelyrics.com/lyrics/depeche_mode/get_the_balance_right-lyrics-127613.html	Album: People Are People	"There's more besides joyrides
Little
house in the countryside
Understand, learn to demand,
Compromise,
sometimes lie
Get the Balance right, get the balance
right
Be responsible, respectable,
Stable but
gullible
Concerned and caring, help the helpless
But always remain
ultimately selfish
Get the balance right, get the balance
right
You think you've got a hold of it
all
You haven't got a hold at all
When you reach the top, get ready to
drop
Prepare yourself for the fall, you're gonna fall
It's almost
predictable
Don't take this way, don't take that
way
Straight down the middle until next Thursday
Push to the left, back to
the right
Twist and turn 'til you've got it right
Get the balance right"
Gone	https://www.allthelyrics.com/lyrics/depeche_mode/gone-lyrics-440725.html	Album: Speak Spell	"So tired so soon
What happened to you
What happened to you
You got lost
Somewhere between
There and here
Somewhere between
So far so near
You got lost
Somewhere between
What happened to you
Someone has been removed
What happened to her
What happened to her
She got lost
Somewhere between
There and here
Somewhere between
So far so near
She got lost
Somewhere between
What happened to her
You used to be so young
Used to be so young
It was going to take so long
It had almost gone
What is his name
What is his name
What is his name
What is his name"
Goodnight Lovers	https://www.allthelyrics.com/lyrics/depeche_mode/goodnight_lovers-lyrics-33732.html	Album: Exciter	"Here, somewhere in the heart of me
There is still a part of me
That cares
And I'll, I'll still take the best you've got
Even though I'm sure it's not
The best for me
When you're born a lover
You're born to suffer
Like all soul sisters
And soul brothers
I, I can see the danger signs
They only help to underline
Your beauty
I'm not looking for an easy ride
True happiness cannot be tried
So easily
When you're born a lover
You're born to suffer
Like all soul sisters
And soul brothers
Like all soul sisters
And soul brothers
You can take your time
I'll be waiting in line
You don't even have to give me
The time of day
When you're born a lover
You're born to suffer
Like all soul sisters
And soul brothers
Like all soul sisters
And soul brothers"
Halo	https://www.allthelyrics.com/lyrics/depeche_mode/halo-lyrics-46515.html	Album: Songs Of Faith And Devotion - Live	"You wear guilt
Like shackles on your feet
Like a halo in reverse
I can feel
The discomfort in your seat
And in your head it's worse
There's a pain
A famine in your heart
An aching to be free
Can't you see
All love's luxuries
Are here for you and me
And when our worlds
They fall apart
When the walls come tumbling in
Though we may deserve it
It will be worth it
Bring your chains
Your lips of tragedy
And fall into my arms
And when our worlds
They fall apart
When the walls come tumbling in
Though we may deserve it
It will be worth it"
Happiest Girl	https://www.allthelyrics.com/lyrics/depeche_mode/happiest_girl-lyrics-46381.html	Album: A Broken Frame	"Happiest girl I ever knew
Happiest girl I ever knew
Wanted to feel the joy
Flow between our lips
Wanted to feel the joy
Flow between our hips
Happiest girl I ever knew
Why do you smile the smile you do
Happiest girl I ever knew
Wanted to feel the joy
Pass between our eyes
Wanted to feel the joy
Pass between our thighs
And I would have to pinch her
Just to see if she was real
Just to watch the smile fade away
And see the pain she'd feel
Wanted to feel her joy
Feel it deep within
Wanted to feel her joy
Penetrate my skin
Happiest girl I ever knew
Why do you smile the smile you do"
Here Is The House	https://www.allthelyrics.com/lyrics/depeche_mode/here_is_the_house-lyrics-46468.html	Album: Music For The Masses	"Here is the house
Where it all happened
Those tender moments
Under this roof
Body and soul come together
As we come closer together
And as it happens
It happens here
In this house
And I feel your warmth
And it feels like home
And there's someone
Calling on the telephone
Let's stay home
It's cold outside
And I have so much
To confide to you
With or without words
I'll confide everything
Here is the house
Where it all happened
Those tender moments
Under this roof
Body and soul come together
As we come closer together
And as it happens
It happens here
In this house
So we stay at home
And I'm by your side
And you know
What's going on inside
Inside my heart
Inside this house
And I just want to
Let it out for you
And I feel your warmth
And it feels like home
And I feel your warmth
And it feels like home
Here is the house
Where it all happened
Those tender moments
Under this roof
Body and soul come together
As we come closer together"
Higher Love	https://www.allthelyrics.com/lyrics/depeche_mode/higher_love-lyrics-46520.html	Album: Ultra	"I can taste more than feel
This burning inside is so real
I can almost lay my hands upon
The warm glow that lingers on
Moved, lifted higher
Moved, my soul's on fire
Moved, by a higher love
I surrender all control
To the desire that consumes me whole
And leads me by the hand to infinity
That lies in wait at the heart of me
Moved, lifted higher
Moved, my soul's on fire
Moved, by a higher love
Heaven bound on the wings of love
There's so much that you can rise above
Moved, lifted higher
Moved, moved, by a higher love
By a higher love
I surrender heart and soul
Sacrificed to a higher goal
Moved, moved by a higher love
By a higher love"
Hole To Feed	https://www.allthelyrics.com/lyrics/depeche_mode/hole_to_feed-lyrics-1306082.html	Album: Sounds Of The Universe	"We are here, we can love
We share something
I'm sure that you'll mean the world to me
When you get, what you need
It's no way of knowing
What you get is another hole to feed
Your name was the one that was always chosen
Your words and the kindness that set me free
Words can leave you broken inside
You'll have to decide
I'm hanging onto my pride
We are here, we can love
We share something
I'm sure that you'll mean the world to me
The shame as a hole that has kept us frozen
You open my eyes to the world I could believe
This world has left me broken inside
I'll have to decide
I'm hanging onto my pride
Words can leave you broken inside
You'll have to decide
I'm hanging onto my pride
We are here
This world can leave you broken inside
I'll have to decide
I'm hanging onto my pride
We are here, we can love
We share something
I'm sure that you'll mean the world to me
The shame as a hole that has kept us frozen
You open my eyes to the world I could believe"
Huckleberry	https://www.allthelyrics.com/lyrics/depeche_mode/huckleberry-lyrics-127621.html	-	"Just off of the two-lane where the school bus used to stop
Was a little wooden A-frame with a yellow tin roof top
One day it was raining on this world
She said 'have you ever really, really ever kissed a girl?'
Baby I'll be your Huckleberry, you don't have to double dare me
If the storm gets wild and scary count on me to be right there
You're so extra ordinary sweet like maraschino cherries
We'll grow up and we'll get married
I'm gonna be your Huckleberry
Later on that summer we went to the county fair
They had a brand new roller-coaster and everyone was scared
It was two bucks to experience the thrill
She said 'come on boy let's get in line, I'll ride it if you will'
Baby I'll be your Huckleberry, you don't have to double dare me
If the ride gets wild and scary count on me to be right there
You're so extra ordinary sweet like maraschino cherries
We'll grow up and we'll get married
I'm gonna be your Huckleberry
Snuck off on a slow dance at the junior/senior prom
Went lookin for some romance before I had to get her home
Steamin up the windows of my car
She said 'until I get my wedding ring boy we can't go that far'
Baby I'll be your Huckleberry, you don't have to double dare me
If the world gets wild and scary count on me to be right there
You're so extra ordinary sweet like maraschino cherries
We grew up and we got married
Now look at those three little Huckleberries"
I Am You	https://www.allthelyrics.com/lyrics/depeche_mode/i_am_you-lyrics-33731.html	Album: Exciter	"You have bound my heart with subtle chains
So much pleasure that it feels like pain
So entwined now that we can't shake free
I am you and you are me
No escaping from the mess we're in
So much pleasure that it must be sin
I must live with this reality
I am yours eternally
There's no turning back
We're in this trap
No denying the facts
No, no, no
No excuses to give
I'm the one you're with
We've no alternative
No, no, no
Dark obsession in the name of love
This addiction that we're both part of
Leads us deeper into mystery
Keeps us craving endlessly
Strange compulsions that I can't control
Pure possession of my heart and soul
I must live with this reality
I am you and you are me
I am you and you are me
I am you and you are me
I am you and you are me
There's no turning back
We're in this trap
No denying the facts
No, no, no
No excuses to give
I'm the one you're with
We've no alternative
No, no, no"
I Feel Loved	https://www.allthelyrics.com/lyrics/depeche_mode/i_feel_loved-lyrics-33729.html	Album: Exciter	"It's the dark night of my soul
And temptation's taking hold
But through the pain and the suffering
Through the heartache and trembling
I feel loved
I feel loved
As the darkness closes in
In my head I hear whispering
Questioning and beckoning
But I'm not taken in
I feel loved
I feel loved
From the depths of my emptiness
Comes a feeling of inner bliss
I feel wanted, I feel desired
I can feel my soul on fire
I feel loved
I feel loved"
I Feel You	https://www.allthelyrics.com/lyrics/depeche_mode/i_feel_you-lyrics-46535.html	Album: The Singles 86>98	"I feel you
Your sun it shines
I feel you
Within my mind
You take me there
You take me where
The kingdom comes
You take me to
And lead me through Babylon
This is the morning of our love
It's just the dawning of our love
I feel you
Your heart it sings
I feel you
The joy it brings
Where heaven waits
Those golden gates
And back again
You take me to
And lead me through oblivion
This is the morning of our love
It's just the dawning of our love
I feel you
Your precious soul
And I am whole
I feel you
Your rising sun
My kingdom comes
I feel you
Each move you make
I feel you
Each breath you take
Where angels sing
And spread their wings
My love's on high
You take me home
To glory's throne
By and by
This is the morning of our love
It's just the dawning of our love"
I Like It	https://www.allthelyrics.com/lyrics/depeche_mode/i_like_it-lyrics-46355.html	Album: A Broken Frame	"I like it, I like it
I like the way you run your fingers through my hair
And I love the way you tickle my chin
And I like the way you let yourself in when your mommy's not there
I like it, I like it
I like the things you say and all the things you do
And I like the way you straighten my tie
And I like the way you're winking your eye
And I know I like you
And I know I like you
Do that again
You're driving me insane
Kiss me once more
That's another thing I like you for
I like it, I like it
I like the funny feelings when I'm with you
And I like you more with every day
And I like to always hearing you say you're liking it too
You're liking it too
Do that again
You're driving me insane
Kiss me once more
That's another thing I like you for
I like it, I like it
I like the funny feelings when I'm with you
With every day
And I like to always hearing you say you're liking it too
You're liking it too
Whoa, I like it
Are you liking it too?"
I Promise You I Will	https://www.allthelyrics.com/lyrics/depeche_mode/i_promise_you_i_will-lyrics-515864.html	-	"if you need a friend
don't look to a stranger
you know in the end
i'll always be there
and when you're in doubt
and when you're in danger
take a look all around
and i'll be there
im sorry, but im just thinking of the right words to say
(i promise you)
i know they don't sound the way i planned them to be
(i promise you)
but if u wait around the world, i'll make you fall for me
(i promise you)
i promise you, i promise you i will
when your day is through
and so is your temper
you know that to do
i'll always be there
sometimes if i shout
it's not quite intended
these words just come out
with no cross to bear
im sorry, but im just thinking of the right words to say
(i promise you)
i know they don't sound the way i planned them to be
(i promise you)
but if u wait around the world, i'll make you fall for me
(i promise you)
i promise you, i promise you
im sorry, but im just thinking of the right words to say
(i promise you)
i know they don't sound the way i planned them to be
(i promise you)
but if i have to walk the world, and make you fall for me
(i promise you)
i promise you, i promise you i will
i gotta tell ya
i need to tell ya
i've got to tell ya
i gotta tell ya
im sorry, but im just thinking of the right words to say
(i promise you)
i know they don't sound the way i planned them to be
(i promise you)
but if u wait around the world, i'll make you fall for me
(i promise you)
i promise you, i promise you
im sorry, but im just thinking of the right words to say
(i promise you)
i know they don't sound the way i planned them to be
(i promise you)
but if i have to walk the world, and make you fall for me
(i promise you)
i promise you, i promise you i will
i will
i will"
I Sometimes Wish I Was Dead	https://www.allthelyrics.com/lyrics/depeche_mode/i_sometimes_wish_i_was_dead-lyrics-46360.html	Album: A Broken Frame	"New sound all around
You can hear it too
Getting hot, never stop
Just for me and you
Playing on my radio and saying that you had to go
New day turn away
Wipe away the tear
New night, feel right
Knowing that you're here
Dancing with you all the time, and don't you think that it's a crime
Back street never meet
Never say goodbye
I know where you go
But I don't know why
You say that it's from above, and I say this is modern love"
I Want You Now	https://www.allthelyrics.com/lyrics/depeche_mode/i_want_you_now-lyrics-46489.html	Album: 101	"I want you now
Tomorrow won't do
There's a yearning inside
And it's showing through
Reach out your hands
And accept my love
We've waited for too long
Enough is enough
I want you now
My heart is aching
My body is burning
My hands are shaking
My head is turning
You understand
It's so easy to choose
We've got time to kill
We've got nothing to lose
I want you now
And I don't mean to sound
Like one of the boys
That's now what I'm trying to do
I don't want to be
Like one of the boys
I just want you now
Because I've got a love
A love that won't wait
A love that is growing
And it's getting late
Do you know what it means
To be left this way
When everyone's gone
And the feelings they stay
I want you now"
Ice Machine	https://www.allthelyrics.com/lyrics/depeche_mode/ice_machine-lyrics-46359.html	Album: A Broken Frame	"Running through my head secretly
The shouts of the boys in the factory
I ring you on the telephone silently
Like blood, like the wine in the darkroom scene
The darkroom scene
Darkroom scene
A letter
Once composed
Seven years long and as tall as a tree
Reading
On the wall
Emissions, efficiency
Efficiency
Efficiency
Resurrect
As a feeling
On my window
Of a past reunion
Resurrect
As a feeling
On my window
Of a past reunion
Vision
Of a picture
Like the city
And the air we breathe
The air we breathe
Air we breathe
She stood beside me once again
I knew her face
We met before in the street
Recalling all the children dancing at our feet
The dancing feet, dancing feet"
If You Want	https://www.allthelyrics.com/lyrics/depeche_mode/if_you_want-lyrics-46362.html	Album: Black Celebration	"Working week's come to its end
Party time is here again
Everyone can come if they want to
If you want to be with me
If you want to be with me
You can come with me if you want to
Exercise your basic right
We could build a building site
From the bricks of shame is built the hope
If you want to be with me
If you want to be with me
Even though you may still not want to
Let tomorrow and today
Bring a life of ecstacy
Wipe away your tears of confusion
If you want to be with me
If you want to be with me
You can come with me if you want to
Even though you still may not want to"
In A Manner Of Speaking	https://www.allthelyrics.com/lyrics/depeche_mode/in_a_manner_of_speaking-lyrics-440724.html	Album: Speak Spell	"In a manner of speaking
I just want to say
That I could never forget the way
You told me everything
By saying nothing
In a manner of speaking
I don't understand
How love in silence becomes reprimand
But the way I feel about you
Is beyond words
Oh give me the words
Give me the words
That tell me nothing
Oh give me the words
Give me the words
That tell me everything
In a manner of speaking
Semantics won't do
In this life that we live
We only make do
And the way that we feel
Might have to be sacrificed
So in a manner of speaking
I just want to say
That like you I should find a way
To tell you everything
By saying nothing
Oh give me the words
Give me the words
That tell me nothing
Oh give me the words
Give me the words
Give me the words
Give me the words
Give me the words"
