song	link	album	lyrics
(Set Me Free) Remotivate Me	https://www.allthelyrics.com/lyrics/depeche_mode/set_me_free_remotivate_me-lyrics-515930.html	Album: Speak Spell	"Set me free
Set me free
Remotivate me
Set me burning
After years in deep freeze
My body is yearning
For a new lease of life
And a little spice
Set me free
Remotivate me
Give me a reason
To scream and shout
Give me something
To get excited about
When everything is looking dull
I'm sure it isn't impossible to
Set me free
Remotivate me
Remotivate me
Set me burning
After years in deep freeze
My body is yearning
For a new lease of life
And a little spice
Set me free
Remotivate me
Don't think I'm impatient
Because I'm willing to wait
But something must must happen
Before it gets too late
It could be my imagination
But wasn't there more than this dull sensation
Set me free
Remotivate me"
A Photograph Of You	https://www.allthelyrics.com/lyrics/depeche_mode/a_photograph_of_you-lyrics-46408.html	Album: People Are People	"What good is a photograph of you
Everytime I look at it
It makes me feel blue
What use is a souvenir
Of something we once had
When all it ever does is
Make me feel bad
I wish I could tear it up
But then again I haven't the guts
I wish I could throw it on the fire
I wish I could
But to say I would
I'd be a liar
What good is a colour print
Of a little baby doll
When just one little glance
Is enough to make me feel dull
I hoped I would misplace it
But then I take such good care of it
I wish it would disappear
I say I wish
But then I relish
It being here"
A Question Of Time	https://www.allthelyrics.com/lyrics/depeche_mode/a_question_of_time-lyrics-46473.html	Album: The Singles 86>98	"Fragile
Like a baby in your arms
Be gentle with me
I'd never willingly
Do you harm
Apologies
Are all you ever seem to get from me
But just like a child
You make me smile
When you care for me
And you know...
It's a question of lust
It's a question of trust
It's a question of not letting
What we've built up
Crumble to dust
It is all of these things and more
That keep us together
Independence
Is still important for us though (we realise)
It's easy to make
The stupid mistake
Of letting go (do you know what I mean)
My weakness
You know each and every one (it frightens me)
But I need to drink
More than you seem to think
Before I'm anyone's
And you know...
It's a question of lust
It's a question of trust
It's a question of not letting
What we've built up
Crumble to dust
It is all of these things and more
That keep us together
Kiss me goodbye
When I'm on my own
But you know that I'd
Rather be home
It's a question of lust
It's a question of trust
It's a question of not letting
What we've built up
Crumble to dust
It is all of these things and more
That keep us together"
A Song For Europe	https://www.allthelyrics.com/lyrics/depeche_mode/a_song_for_europe-lyrics-440728.html	Album: Speak Spell	"Here
As I sit
At this empty cafe
Thinking of you
I remember
All those moments
Lost in wonder
That we'll never
Find again
Though the world
Is my oyster
It's only a shell
Full of memories
Here by the Seine
Notre-Dame casts
A long lonely shadow
Now only sorrow
No tomorrow
There's no today for us
Nothing is there
For us to share
But yesterday
This is my song
This is my song
This is my song
These cities may change
But there always remains
My obsession
Through silken waters
My gondola glides
And the bridge
it sighs
I remember
All those moments
Lost in wonder
That we'll never
Find again
There's no more time for us
Nothing is there
For us to share
But yesterdays
All those moments
Lost in wonder
That we'll never
Find again
All those moments
Lost in wonder
That we'll never
Find again
All those moments
Lost in wonder
That we'll never
Find again"
Addiction	https://www.allthelyrics.com/lyrics/depeche_mode/addiction-lyrics-434216.html	-	"I can't help it, I'm not sure what to do
Does seem crazy, no good for my health
I've seen the doctor, he's come to look at me
If you don't believe it, don't believe
Closer all the time, Closer all the time
Closer all the time, Closer all the time
Now I'm saying how I'm going to need a pill
I need you like a drug to keep my fill
I can't remember everything I do
Now I put them, it's only good to you
Closer all the time, Closer all the time
Closer all the time, Closer all the time
You can't help but look me in the eye
While I come running, I don't know why
It's an addiction, image of love
Your heart pushing, angel from above
Closer all the time, Closer all the time
Closer all the time, Closer all the time
Closer all the time, Closer all the time
Close!"
Addiction (Aka Ghost Of Modern Time)	https://www.allthelyrics.com/lyrics/depeche_mode/addiction_aka_ghost_of_modern_time-lyrics-46356.html	Album: A Broken Frame	"I can't help it, I'm not sure what to do
Does seem crazy, no good for my health
I've seen the doctor, he's come to look at me
If you don't believe it, don't believe
Closer all the time, Closer all the time
Closer all the time, Closer all the time
Now I'm saying how I'm going to need a pill
I need you like a drug to keep my fill
I can't remember everything I do
Now I put them, it's only good to you
Closer all the time, Closer all the time
Closer all the time, Closer all the time
You can't help but look me in the eye
While I come running, I don't know why
It's an addiction, image of love
Your heart pushing, angel from above
Closer all the time, Closer all the time
Closer all the time, Closer all the time
Closer all the time, Closer all the time
Close!"
Addiction (Also Known As Ghost Of Modern Time)	https://www.allthelyrics.com/lyrics/depeche_mode/addiction_also_known_as_ghost_of_modern_time-lyrics-880631.html	-	"I can't help it, I'm not sure what to do
Does seem crazy, no good for my health
I've seen the doctor, he's come to look at me
If you don't believe it, don't believe
Closer all the time, Closer all the time
Closer all the time, Closer all the time
Now I'm saying how I'm going to need a pill
I need you like a drug to keep my fill
I can't remember everything I do
Now I put them, it's only good to you
Closer all the time, Closer all the time
Closer all the time, Closer all the time
You can't help but look me in the eye
While I come running, I don't know why
It's an addiction, image of love
Your heart pushing, angel from above
Closer all the time, Closer all the time
Closer all the time, Closer all the time
Closer all the time, Closer all the time
Close!"
And Then...	https://www.allthelyrics.com/lyrics/depeche_mode/and_then-lyrics-46422.html	Album: Some Great Reward	"Let's take a map of the world
Tear it into pieces
All of the boys and the girls
Will see how easy it is
To put it all down and start again
From the top to the bottom and then
I'll have faith, or I prefer
To think that things couldn't turn out worse
All that we need at the start's
Universal revolution (that's all)
And if we trust in our hearts
We'll find the solution's
To put it all down and start again
From the top to the bottom and then
I'll have faith, or I prefer
To think that things couldn't turn out worse
Took a plane across the world
Got in a car
And when I reached my destination
I hadn't gone far
Let's take the whole of the world
The mountains and the sand
Let all the boys and the girls
Shape it in their hands
To put it all down and start again
From the top to the bottom and then
I'll have faith, or I prefer
To think that things couldn't turn out worse"
Any Second Now	https://www.allthelyrics.com/lyrics/depeche_mode/any_second_now-lyrics-46389.html	Album: Construction Time Again	"She remembered all the shadows and the doubts
The same film
Vivid pictures like a wall that's standing empty
And the night so still
Such a small affair a relapse someone closing
Like the nightclub door
Here again and when you speak I watch you move away
And seem so sure
She is hoping to forget and the moment
Almost slips away
When the colours move apart and I wonder
If you want to stay
And I need to change you like the words I'm reading
Don't you understand
This the warning and the message I remember
As you touch my hand"
Barrel Of A Gun	https://www.allthelyrics.com/lyrics/depeche_mode/barrel_of_a_gun-lyrics-46548.html	Album: The Singles 86>98	"Do you mean this horny creep
Set upon weary feet
Who looks in need of sleep
That doesn't come
This twisted, tortured mess
This bed of sinfulness
Who's longing for some rest
And feeling numb
What do you expect of me
What is it you want
Whatever you've planned for me
I'm not the one
A vicious appetite
Visits me each night
And won't be satisfied
Won't be denied
An unbearable pain
A beating in my brain
That leaves the mark of Cain
Right here inside
What am I supposed to do
When everything that I've done
Is leading me to conclude
I'm not the one
Whatever I've done
I've been staring down the barrel of a gun
Is there something you need from me
Are you having your fun
I never agreed to be
Your holy one
Whatever I've done
I've been staring down the barrel of a gun"
Behind The Wheel	https://www.allthelyrics.com/lyrics/depeche_mode/behind_the_wheel-lyrics-46490.html	Album: The Singles 86>98	"My little girl
Drive anywhere
Do what you want
I don't care
Tonight
I'm in the hands of fate
I hand myself
Over on a plate
Now
Oh little girl
There are times when I feel
I'd rather not be
The one behind the wheel
Come
Pull my strings
Watch me move
I do anything
Please
Sweet little girl
I prefer
You behind the wheel
And me the passenger
Drive
I'm yours to keep
Do what you want
I'm going cheap
Tonight
You're behind the wheel tonight"
Black Celebration	https://www.allthelyrics.com/lyrics/depeche_mode/black_celebration-lyrics-46484.html	Album: Violator	"Let's have a black celebration
Black celebration
Tonight
To celebrate the fact
That we've seen the back
Of another black day
I look to you
How you carry on
When all hope is gone
Can't you see
Your optimistic eyes
Seem like paradise
To someone like
Me
I want to take you
In my arms
Forgetting all I couldn't do today
Black celebration
Black celebration
Tonight
To celebrate the fact
That we've seen the back
Of another black day
I look to you
And your strong belief
Me, I want relief
Tonight
Consolation
I want so much
Want to feel your touch
Tonight
Take me in your arms
Forgetting all you couldn't do today
Black celebration
I'll drink to that
Black celebration
Tonight"
Black Day	https://www.allthelyrics.com/lyrics/depeche_mode/black_day-lyrics-46386.html	Album: A Broken Frame	"[An alternate version of ""Black Celebration""]
Celebrate the fact
That we've seen the back
Of another black day
Celebrate the fact
That we've seen the back
Of another black day
Black day
Black day
I want to take you in my arms
Forgeting all I couldn't do today
Black day"
Blasphemous Rumours	https://www.allthelyrics.com/lyrics/depeche_mode/blasphemous_rumours-lyrics-46442.html	Album: The Singles 81>85	"Girl of 16
Whole life ahead of her
Slashed her wrists
Bored with life
Didn't succeed
Thank the lord
For small mercies
Fighting back the tears
Mother reads the note again
16 candles burn in her mind
She takes the blame
It's always the same
She goes down on her knees
And prays
I don't want to start
Any blasphemous rumours
But I think that God's
Got a sick sense of humour
And when I die
I expect to find Him laughing
Girl of 18
Fell in love with everything
Found new life
In Jesus Christ
Hit by a car
Ended up
On a life support machine
Summer's day
As she passed away
Birds were singing
In the summer sky
Then came the rain
And once again
A tear fell
From her mother's eye"
Blue Dress	https://www.allthelyrics.com/lyrics/depeche_mode/blue_dress-lyrics-46508.html	Album: Songs Of Faith And Devotion - Live	"Put it on
And don't say a word
Put it on
The one that I prefer
Put it on
And stand before my eyes
Put it on
Please don't question why
Can you believe
Something so simple
Something so trivial
Makes me a happy man
Can't you understand
Say you believe
Just how easy
It is to please me
Because when you learn
You'll know what makes the world turn
Put it on
I can feel so much
Put it on
I don't need to touch
Put it on
Here before my eyes
Put it on
Because you realise
And you believe
Something so worthless
Serves a purpose
It makes me a happy man
Can't you understand
Say you believe
Just how easy
It is to please me
Because when you learn
You'll know what makes the world turn"
Boys Say Go!	https://www.allthelyrics.com/lyrics/depeche_mode/boys_say_go-lyrics-46397.html	Album: Construction Time Again	"You don't understand
This is a demand
And I think that I have to show you
Try to look inside
Take me for a ride
In the day and the night
Get to know you
Boys meet boys get together
Boys meet boys live forever
Don't say no
Boys say go
I can run away
If you never stay
And the rain and the pain and the sorrow
I'm not very sure
When you close the door
If the end is the same as tomorrow
Boys!
Boys!
Boys say go!"
Breathe	https://www.allthelyrics.com/lyrics/depeche_mode/breathe-lyrics-33730.html	Album: Exciter	"I heard a rumour
They travel far
You know what it's like
The way people are
They talk and they talk
Though they don't understand
They'll whisper and whisper
And lie on demand
Please tell me now
I want to know
I have to hear it from your lips
Say it's not so
 
I heard it on Monday
And I laughed a while
I heard it on Tuesday
I managed to smile
I heard it on Wednesday
My patience was tried
I heard it on Thursday
And I hurt inside
I want to know
The depths of your mind
Tell me this whole thing is madness
And we're doing fine
Put your little hand in mine
And believe in love
Put your head on my chest
And breathe love
Breathe love
Breathe love
Breathe love
 
I heard it from Peter
Who heard it from Paul
Who heard it from someone
I don't know at all
I heard it from Mary
Who heard it from Ruth
Who swore on the bible
She's telling the truth
I heard it from Simon
Who heard it from James
Confirming with Sarah
That I was to blame
I heard it from Joseph
Who heard it from John
Who said with conviction
That all hope was gone
So I need to know
Your alibis
I need to hear that you love me
Before you say goodbye
Before you say goodbye
Before you say goodbye
Before you say goodbye"
Breathing In Fumes	https://www.allthelyrics.com/lyrics/depeche_mode/breathing_in_fumes-lyrics-46385.html	Album: A Broken Frame	"[A dub mix of ""Stripped""]
Nothing on this
I taste when we kiss
Come back to the land
For a few hours
Let me see you
Stripped down to the bone
Taste when we kiss
I taste when we kiss
You're breathing in fumes
I taste when we kiss
Let me see you
Stripped down to the
I taste when we kiss
I taste when we kiss
Let me see you
Stripped down to the
Come back to the land
Come back to the land
Let me see you
Stripped down to the bone
Breathing in fumes
I'm breathing in fumes
Breathing in fumes
You're breathing in fumes"
But Not Tonight	https://www.allthelyrics.com/lyrics/depeche_mode/but_not_tonight-lyrics-46371.html	Album: Music For The Masses	"Oh God it's raining
But I'm not complaining
It's filling me up with new life
The stars in the sky
Bring tears to my eyes
They're lighting my way tonight
And I haven't felt so alive
In years
Just for a day
On a day like today
I'll get away from this constant debauchery
The wind in my hair
Makes me so aware
How good it is to live tonight
And I haven't felt so alive
In years
The moon
Is shining in the sky
Reminding me
Of so many other nights
But they're not like tonight
Oh God it's raining
And I'm not containing
My pleasure at being so wet
Here on my own
All on my own
How good it feels to be alone tonight
And I haven't felt so alive
In years
The moon
Is shining in the sky
Reminding me
Of so many other nights
When my eyes had been so red
I'd been mistaken for dead
But not tonight"
Clean	https://www.allthelyrics.com/lyrics/depeche_mode/clean-lyrics-46507.html	Album: Songs Of Faith And Devotion - Live	"Clean
The cleanest I've been
An end to the tears
And the in-between years
And the troubles I've seen
Now that I'm clean
You know what I mean
I've broken my fall
Put an end to it all
I've changed my routine
Now I'm clean
I don't understand
What destiny's planned
I'm starting to grasp
What is in my own hands
I don't claim to know
Where my holiness goes
I just know that I like
What is starting to show
Sometimes
As years go by
All the feelings inside
Twist and they turn
As they ride with the tide
I don't advise
And I don't criticise
I just know what I like
With my own eyes
Sometimes
Sometimes"
Comatose	https://www.allthelyrics.com/lyrics/depeche_mode/comatose-lyrics-33727.html	Album: Exciter	"Comatose, almost
You've got me dreaming
Slipping in
And Sliding out
Of conscious feeling
Take a light
Start the flame
Play the game
I am lost
In your eyes
Hypnotised
Here I believe
Dreams never deceive
Comatose, almost
You've got me dreaming
Slipping in
And sliding out
Life has no meaning
Bodies move
Colours change
Girl you're strange
Here inside
I'm at home
I'm alive
Don't be afraid
I'm floating away
Comatose, almost
You've got me dreaming
Slipping in
And sliding out
Of conscious feeling
Comatose, almost
Comatose, almost
Comatose."
Come Back	https://www.allthelyrics.com/lyrics/depeche_mode/come_back-lyrics-1306087.html	Album: Sounds Of The Universe	"Come back, come back to me
I'll be waiting patiently
Come back, come back to me
I'll be waiting here patiently
Walking a thin white line between love and hate
Wasting all my time in another world
In another place
I could use a little company
A little kindness could go a long way
Weeks turn into months
Months turn into years
Reaching the same conclusions
Gathering up the fear
Come back, come back to me
I'll be waiting patiently
Come back, come back to me
I'll be waiting here patiently
Light will always shine in the heart of you
In truth and in reality
Only blindness can hide it away
I could use a little restraint
A little kindness can go a long way
Weeks turn into months
Months turn into years
Reaching the same conclusions
Gathering up the fear
Living the same delusions
Gathering up the fear
Gathering up the fear
Gathering up the fear
Gathering up the fear
Come back
Come back
Come back
Come back
Come back"
Coming Back To You	https://www.allthelyrics.com/lyrics/depeche_mode/coming_back_to_you-lyrics-440727.html	Album: Speak Spell	"Maybe I'm still hurting
I can't turn the other cheek
But you know that I still love you
It's just that I can't speak
I looked for you in everyone
And they called me on that too
I lived alone but I was only
Coming back to you
Ah they're shutting down the factory now
Just when all the bills are due
And the fields they're under lock and key
Though the rain and the sun come through
And springtime starts but then it stops
In the name of something new
And all the senses rise against this
Coming back to you
And they're handing down my sentence now
And I know what I must do
Another mile of silence while I'm
Coming back to you
There are many in your life
And many still to be
Since you are a shining light
There's many that you'll see
But I have to deal with envy
When you choose the precious few
Who've left their pride on the other side of
Coming back to you
Even in your arms I know
I'll never get it right
Even when you bend
To give me comfort in the night
I've got to have your word on this
Or none of it is true
And all I've said was just instead of
Coming back to you"
Compulsion	https://www.allthelyrics.com/lyrics/depeche_mode/compulsion-lyrics-440726.html	Album: Speak Spell	"Charms in limited supply
And refusing to stretch
That indefinable nothing
Somehow keeps pushing you
Finding the right words
Can be a problem
How many times must it be said
There's no plan
It had to happen
Got to move on sometime
And it's about time
By putting one foot in front on another
And repeating the process
Cross over the street
You're free to change your mind
Strength through diversity
Couldn't have put it more plainly
Got to move on sometime
Got to move on sometime
Got to move on sometime
Got to move on sometime
Charms in limited supply
Under threat of extinction
That indefinable nothing
Somehow motivates you
Finding the right words
Can be a problem
How many times must it be said
There's no plan
It had to happen
Got to move on sometime
And it's about time
By putting one foot in front on another
And repeating the process
Cross over the street
You're free to change your mind
Strength through diversity
Couldn't have put it more plainly
Got to move on sometime"
Condemnation	https://www.allthelyrics.com/lyrics/depeche_mode/condemnation-lyrics-46531.html	Album: The Singles 86>98	"Condemnation
Tried
Here on the stand
With the book in my hand
And truth on my side
Accusations
Lies
Hand me my sentence
I'll show no repentance
I'll suffer with pride
If for honesty
You want apologies
I don't sympathize
If for kindness
You substitute blindness
Please open your eyes
Condemnation
Why
Because my duty
Was always to beauty
And that was my crime
Feel elation
High
To know I can trust this
Fix of injustice
Time after time
If you see purity
As immaturity
Well it's no surprise
If for kindness
You substitute blindness
Please open your eyes"
Corrupt	https://www.allthelyrics.com/lyrics/depeche_mode/corrupt-lyrics-1306091.html	Album: Sounds Of The Universe	"I could corrupt you
In a heart beat
You think you're so special
Think you're so sweet
What are you trying don't even tempt me
Soon you'll be crying, unwishing you dreamt of be
You'll be calling out my name
When you need someone to blame
I could corrupt you
It would be easy
Watching you suffer
Girl, it would please me
But I wouldn't touch you
With my little finger
I know it would crush you
My memory would linger
You'd be crying out in pain
Begging me to play my games
I could corrupt you
It would be ugly
They could sedate you
But i wanna touch you with my hands on your hips
It would be too much to
Place my lips on your lips
You'd be calling out my name
Begging me to play my games"
Dangerous	https://www.allthelyrics.com/lyrics/depeche_mode/dangerous-lyrics-46384.html	Album: A Broken Frame	"The things you do
Aren't good for my health
The moves you make
You make for yourself
The means you use
Aren't meant to confuse
Although they do
They're the ones that I would choose
And I wouldn't want it any other way
You wouldn't let me anyway
Dangerous
The way you leave me wanting more
Dangerous
That's what I want you for
Dangerous
When I am in your arms
Dangerous
Know I will come to harm
The lies you tell
Aren't meant to deceive
They're not there
For me to believe
I've heard
Your vicious words
You know by now
It takes a lot to see me hurt
And I couldn't take it any other way
But there's a price I have to pay"
Death's Door	https://www.allthelyrics.com/lyrics/depeche_mode/deaths_door-lyrics-46383.html	Album: A Broken Frame	"Well I'm knocking on Death's door
Will I take my rest, among the blessed
Mother are you waiting
Father are you pacing
I'm coming home
I'm knocking on Death's door
Will I take my rest, in my Sunday best
Mother are you anxious
Father are you gracious
I'm coming home
I've been away too long
For so long you've been strong
I've been away too long
I know that it was wrong
But I'm coming home
Well I'm knocking on Death's door
Will I take my rest, have I passed the test
Mother are you praying
Father I am saying
I'm coming home"
Dirt	https://www.allthelyrics.com/lyrics/depeche_mode/dirt-lyrics-372815.html	Album: I Feel Loved, Pt. 1	"Ooh, I've been dirt
And I don't care
Ooh, I've been dirt
And I don't care
'Cause I'm burning inside
'Cause I'm burning inside
I'm the fire of life
Yeah alright
Ooh, I've been hurt
And I don't care
Ooh, I've been hurt
And I don't care
'Cause I'm burning inside
'Cause I'm burning inside
And do you feel it
Said do you feel it when you touch me
I said do you feel it when you touch me
I'm a fire
Well there's a fire
Yeah, alright
It's just a burning inside
It's just a burning inside
Said do you feel it
Said do you feel it when you cut me
Said do you feel it when you cut me
There's a fire
There's a fire
A fire
Inside
It was just a dreaming"
Dream On	https://www.allthelyrics.com/lyrics/depeche_mode/dream_on-lyrics-33721.html	Album: Exciter	"As your bony fingers close around me
Long and spindly
Death becomes me
Heaven can you see what I see
Hey you pale and sickly child
You're death and living reconciled
Been walking home a crooked mile
Paying debt to karma
You party for a living
What you take won't kill you
But careful what you're giving
There's no time for hesitating
Pain is ready, pain is waiting
Primed to do it's educating
Unwanted, uninvited kin
It creeps beneath your crawling skin
It lives without it lives within you
Feel the fever coming
You're shaking and twitching
You can scratch all over
But that won't stop you itching
Can you feel a little love
Can you feel a little love
Dream on dream on
Blame it on your karmic curse
Oh shame upon the universe
It knows its lines
It's well rehearsed
It sucked you in, it dragged you down
To where there is no hallowed ground
Where holiness is never found
Paying debt to karma
You party for a living
What you take won't kill you
But careful what you're giving
Can you feel a little love
Can you feel a little love
Dream on dream on"
Dreaming Of Me	https://www.allthelyrics.com/lyrics/depeche_mode/dreaming_of_me-lyrics-46398.html	Album: The Singles 81>85	"Light switch
Man switch
Film was broken only then
All the night
Fused tomorrow
Dancing with a distant friend
Filming and screning
I picture the scene
Filming and dreaming
Dreaming of me
So we left
Understanding
Cleancut so we're sounding fast
Talked of sad
I talked of war
I laughed and climbed the rising cast
Quickly I remembered
Fused and saw a face before
Timing reason
Understanding
Like association hall"
