song	link	album	lyrics
Salome	https://www.allthelyrics.com/lyrics/u2/salome-lyrics-328392.html	Even Better Than the Real Thing	"Baby please
Baby please don't go
I got eyes to feed, they want skin and seed
Now don't make me crawl
Baby please
Baby don't bite your lip
Give you half what I've got if you untie the knot
It's a promise
Salome
Salome
Salome
Salome
Yeah, yeah, yeah
Baby please
Baby, what's that tune
Well, I heard it before when I crawled from the door
And my blood turned blue
Baby please
Baby please slow down
Baby, I feel sick
Don't make me stick to a promise
Salome
Salome
Salome
Salome
Salome
Salome
I got to get you
Got to, got to get you
I got to get you
Got to, got to get you
I got to get you
Got to, got to get you
I got to get you
Got to, got to get you
I got to get you
Got to, got to get you
I got to get you
Got to, got to get you
I got to get you
Got to, got to get you
I got to get you
Got to, got to get you
I got to get you
Got to, got to get you
I got to get you
Got to, got to get you
I got to get you
Got to, got to get you
I got to get you
Got to, got to get you
Baby please
I got to get you
Got to, got to get you
Baby don't sing yet
I got to get you
Got to, got to get you
Won't you dance for me
I got to get you
Got to, got to get you
Beneath the cherry tree
I got to get you
Got to, got to get you
Won't you swing down low
I got to get you
Got to, got to get you
I got to get you
Got to, got to get you
Please
I got to get you
Got to, got to get you
Baby please say yes
I got to get you
Got to, got to get you
Baby don't go away
I got to get you
Got to, got to get you
Don't spill any of your precious love
I got to get you
Got to, got to get you
Shake it, shake it, shake it Salome
Shake it, shake it, shake it Salome
Shake it, shake it, shake it Salome
Shake it, shake it, shake it Salome
Shake it, shake it, shake it Salome
Shake it, shake it, shake it Salome
Shake it, shake it, shake it Salome
Shake it, shake it, shake it Salome
Salome
I got to get you
Got to, got to get you"
Satellite Of Love	https://www.allthelyrics.com/lyrics/u2/satellite_of_love-lyrics-18584.html	All That You Can't Leave Behind	"Satellite's gone up to the sky
Things like that drive me out of my mind
I watched it for a little while
I love to watch things on TV
Satellite of love
Satellite of love
Satellite of love
Satellite
Satellite's gone, way up to Mars
Soon it will be filled with parking cars
I watched it for a little while
I like to watch things on TV
Satellite of love
Satellite of love
Satellite of love
Satellite
I've been told that you've been bold
With Harry, Mark and John
Monday, Tuesday, Wednesday, Friday,
Harry, Mark and John
Satellite's gone up to the sky
Things like that drive me out of my mind
I watched it for a little while
I love to watch things on TV
Satellite of love
Satellite of love
Satellite of love
Satellite
(This song was written by Lou Reed)"
Seconds	https://www.allthelyrics.com/lyrics/u2/seconds-lyrics-18464.html	War	"Takes a second to say goodbye
Say goodbye, oh, oh, oh
It takes a second to say goodbye
Say goodbye, oh, oh, oh, say bye bye...
Where you going to now...
Lightning flashes across the sky
East to west, do or die
Like a thief in the night
See the world by candlelight.
Fall, rise and...Fall, rise and...
In an apartment on Time Square
You can assemble them anywhere
Held to ransom, hell to pay
A revolution everyday
USSR, GDR, London, New York, Peking
It's the puppets, It's the puppets
Who pull the strings
Fall, rise and...Fall, rise and...
Say goodbye, say goodbye
Say goodbye, say goodbye
Say goodbye
It takes a second to say goodbye
Say goodbye, oh, oh, oh
Push the button and pull the plug
Say goodbye, oh, oh, oh
Fall, rise and...Fall, rise and...
And they're doing the atomic bomb
Do they know where the dance comes from
Yes they're doing the atomic bomb
They want you to sing along
Say goodbye, say goodbye
Say goodbye
Say goodbye."
Shadows And Tall Trees	https://www.allthelyrics.com/lyrics/u2/shadows_and_tall_trees-lyrics-18452.html	Boy	"Back to the cold restless streets at night
I talk to myself about tomorrow night
Walls of white protest
A gravestone in name
Who is it now
It's always the same
Who is it now
Who calls me inside
Are the leaves on the trees
Just living disguise
I walk sweet rain tragicomedy
I'll walk home again
to the street melody
But I know, oh no
But I know, oh no
But I know...
Shadows and tall trees
Shadows and tall trees
Shadows and tall trees
Shadows and tall trees
Life through a window
Discoloured pain
Mrs. Brown's washing is always the same
I walk street rain tragicomedy
I'll walk home again
to the street melody
But I know, oh no
But I know, oh no
But I know...
(Out there)
Do you feel in me...
Anything redeeming
Any worthwhile feeling
Is love like a tightrope
Hanging from the ceiling
But I know, oh no
But I know, oh no
But I know...
Shadows and Tall Trees..."
Silver And Gold	https://www.allthelyrics.com/lyrics/u2/silver_and_gold-lyrics-18558.html	The Best Of 1980-1990 (Disk 2)	"In the shithouse a shotgun
Praying hands hold me down
Only the hunter was hunted
In this tin can town
Tin can town
No stars in the black night
Looks like the sky fall down
No sun in the daylight
Looks like it's chained to the ground
Chained to the ground
The warden says the exit is sold
If you want a way out
Silver and gold
Silver and gold
Broken back to the ceiling
Broken nose to the floor
I scream at the silence, it's crawling
It crawls under the door
There's a rope around my neck
And there's, there's a trigger in your gun
Jesus say something
I am someone, I am someone
Captains and kings in the ships hold
They came to collect
Silver and gold
Silver and gold
See the coming and the going
See the captains and the kings
See them navy blue uniforms
See them bright and shiny things
Bright, shiny things, yeah
The temperature is rising
The fever white hot
Mister, I ain't got nothing
But it's more than you got
Chains no longer bind me
Not the shackles at my feet
Outside are the prisoners
Inside the free
Set them free
Set them free
A prize fighter in a corner is told
Hit where it hurts
Silver and gold
Silver and gold"
Slow Dancing	https://www.allthelyrics.com/lyrics/u2/slow_dancing-lyrics-18589.html	All That You Can't Leave Behind	"My love is cruel as the night
She steals the sun, and shuts out the light
All of my colors, they turn to blue
Win or lose
She does it slow dancing
Slow dancing
She does it slow...dancing
All night long
Scarlet eyes and a see-through heart
She saw me coming right from the start
She picked me up, but had me down on my knees
Just a' beggin' her, beggin' her please
Take me slow dancing
Slow dancing
She took me slow...dancing
All night long
And I don't know a man
Search for himself in his lover's eyes
No I don't know why a man
Sees the truth but needs the lies
My love is restless as the wind
She moves like a shadow across my skin
She left with my conscience, I don't want it back
It just gets in the way
If you wanna go slow dancing
Slow dancing
She took me slow...dancing
All night long
Slow...dancing
Slow...dancing
Slow..."
Slow Dancing (Willie Nelson Version)	https://www.allthelyrics.com/lyrics/u2/slow_dancing_willie_nelson_version-lyrics-1119938.html	If God Will Send His Angels	"(feat. Willie Nelson)
My love is cruel as the night
She steals the sun and shuts out the light
All of my colors turn to blue
Win or lose
She does it slow dancing
Slow dancing
She does it slow dancing
Scarlet eyes and a see-through heart
I saw I coming right from the start
She picked me up, but had me down on my knees
Just a-begging her please
Take me slow dancing
Slow dancing
Slow dancing
Well I don't know why a man
Search for himself in his woman's eyes
No, I don't know why a man
Sees the truth but needs the lies
My love is restless as the wind
She moves like a shadow across my skin
She left with my conscience
I don't want it back
It just gets in the way
If you wanna go slow dancing
Slow dancing
Slow
Slow dancing
Slow dancing
Slow
Slow dancing
Slow dancing
Slow"
Slug	https://www.allthelyrics.com/lyrics/u2/slug-lyrics-18530.html	Passengers: Original Soundtrack	"Don't want to lose my shirt
Don't want to dig the dirt
Don't want you to get hurt
Can't help but I'm a flirt
Don't want to take your drugs
Don't want to be a slug
Don't want to overdress
Don't want to make a mess
Don't want you to confess
Not under duress
Don't want be untrue
I want to be with you
Don't want to lose my nerve
Don't want to throw the curve
Don't want to make you swerve
Don't want what I deserve
Don't want to change the frame
Don't want to be a pain
Don't wanna stay the same"
So Cruel	https://www.allthelyrics.com/lyrics/u2/so_cruel-lyrics-18513.html	Achtung Baby	"We crossed the line
Who pushed who over
It doesn't matter to you
It matters to me
We're cut adrift
But still floating
I'm only hanging on
To watch you go down
My love
I disappeared in you
You disappeared from me
I gave you everything you ever wanted
It wasn't what you wanted
The men who love you, you hate the most
They pass right through you like a ghost
They look for you but your spirit is in the air
Baby, you're nowhere
Oh...love...you say in love there are no rules
Oh...love...sweetheart...
You're so cruel
Desperation is a tender trap
It gets you every time
You put your lips to her lips
To stop the lie
Her skin is pale like God's only dove
Screams like an angel for your love
Then she makes you watch her from above
And you need her like a drug
Oh...love...you say in love there are no rules
Oh...love...sweetheart...
You're so cruel
She wears my love like a see-through dress
Her lips say one thing
Her movements something else
Oh love...like a screaming flower
Love...dying every hour...love
You don't know if it's fear or desire
Danger the drug that takes you higher
Head in heaven, fingers in the mire
Her heart is racing, you can't keep up
The night is bleeding like a cut
Between the horses of love and lust
We are trampled underfoot
Oh...love...you say in love there are no rules
Oh...love...sweetheart...
You're so cruel
Oh...love...to stay with you I'd be a fool
Sweetheart...you're so cruel"
Some Days Are Better Than Others	https://www.allthelyrics.com/lyrics/u2/some_days_are_better_than_others-lyrics-18526.html	Zooropa	"Some days are dry, some days are leaky
Some days come clean, other days are sneaky
Some days take less, but most days take more
Some slip through your fingers and onto the floor
Some days you're quick, but most days you're speedy
Some days you use more force than is necessary
Some days just drop in on us
Some days are better than others
Some days it all adds up
And what you got is not enough
Some days are better than others
Some days are slippy, other days sloppy
Some days you can't stand the sight of a puppy
Your skin is white but you think you're a brother
Some days are better than others
Some days you wake up with her complaining
Some sunny days you wish it was raining
Some days are sulky, some days have a grin
And some days have bouncers and won't let you in
Some days you hear a voice
Taking you to another place
Some days are better than others
Some days are honest, some days are not
Some days you're thankful for what you've got
Some days you wake up in the army
And some days it's the enemy
Some days are work, most days you're lazy
Some days you feel like a bit of a baby
Lookin' for Jesus and His mother
Some days are better than others
Some days you feel ahead
You're making sense of what she said
Some days are better than others
Some days you hear a voice
Taking you to another place
Some days are better than others"
Sometimes You Cant Make It On Your Own	https://www.allthelyrics.com/lyrics/u2/sometimes_you_cant_make_it_on_your_own-lyrics-219133.html	How To Dismantle An Atomic Bomb	"Tough, you think youve got the stuff
Youre telling me and anyone
Youre hard enough
You dont have to put up a fight
You dont have to always be right
Let me take some of the punches
For you tonight
Listen to me now
I need to let you know
You dont have to go it alone
And its you when I look in the mirror
And its you when I dont pick up the phone
Sometimes you cant make it on your own
We fight all the time
You and I thats alright
Were the same soul
I dont need I dont need to hear you say
That if we werent so alike
Youd like me a whole lot more
Listen to me now
I need to let you know
You dont have to go it alone
And its you when I look in the mirror
And its you when I dont pick up the phone
Sometimes you cant make it on your own
I know that we dont talk
Im sick of it all
Can - you - hear - me  when  I -
Sing, youre the reason I sing
Youre the reason why the opera is in me
Where are we now?
Ive got to let you know
A house still doesnt make a home
Dont leave me here alone...
And its you when I look in the mirror
And its you that makes it hard to let go
Sometimes you cant make it on your own
Sometimes you cant make it
The best you can do is to fake it
Sometimes you cant make it on your own"
Spanish Eyes	https://www.allthelyrics.com/lyrics/u2/spanish_eyes-lyrics-18549.html	The Best Of 1980-1990 (Disk 2)	"Wey hey hey, baby hang on
Wey hey hey, baby hang on
Empty heart, beat tight as a drum
Said empty love, she'd shine like a song
Wey hey hey, baby hang on (to anything)
Our love shines like rain
In those spanish eyes
Spanish eyes
Wey hey hey, here she comes
She comes in colors
You know she gonna turn the daylight on
'cause I love the way you talk to me
And I love the way you walk on me
And I need you more
Oh, than you need me
Our love shines like rain
In those spanish eyes
Spanish eyes
I'll cross the world for green and gold
But it's those Spanish eyes
That get me home...home again
Wey hey hey, baby hang on
Wey hey hey, you know that
The night is young
Dazzled by lights that shine in your eyes
I'm standing in the shadows
And wait for the night
Forever in fever, forever in heat
You pick me up to put me out on the street
Wey hey hey, baby hang on, hang on
Wey hey hey, baby hang on, hang on
'cause I love the way you talk to me
And I love the way you're mean to me
And I need you"
Staring At The Sun	https://www.allthelyrics.com/lyrics/u2/staring_at_the_sun-lyrics-18539.html	Pop	"Summer stretching on the grass... summer dresses pass
In the shade of a willow tree creeps a crawling over me
Over me and over you stuck together with God's glue
It's going to get stickier too...
It's been a long hot summer
let's go undercover
Don't try too hard to think... don't think at all
I'm not the only one starin' at the sun
Afraid of what you'd find if you took a look inside
Not just deaf and dumb i'm staring at the sun
Not the only one who's happy to go blind
There's an insect in your ear if you scratch it won't disappear
It's gonna itch and burn and sting
Do you want to see what the scratching brings
Waves that leave me out of reach
Breaking on your back like a beach...
Will we ever live in peace?
Cause those that can't do often have to
Those that can't do often have to... preach
To the ones staring at the sun...
Afraid of what you'll find if you took a look inside
Not just deaf and dumb... staring at the sun
I'm not the only one who'd rather go blind
Intransigence is all around... military is still in town
Armour plated suits and ties... daddy just won't say goodbye
Referee won't blow the whistle God is good but will HE listen
I'm nearly great
But there's something I'm missing I left in the duty free
Though you never really belonged to me
You're not the only one staring at the sun
Afraid of what you'd find if you stepped back inside
I'm not sucking my thumb I'm staring at the sun
Not the only one who's happy to go blind"
Staring At The Sun (Live From Mexico City)	https://www.allthelyrics.com/lyrics/u2/staring_at_the_sun_live_from_mexico_city-lyrics-1119799.html	Hasta La Vista, Baby! Live From Mexico City	"Summer stretching on the grass
Summer dresses pass
In the shade of a willow tree
Creeps a crawling over me
Over me and over you
Stuck together with God's glue
It's gonna get stickier too
It's been a long, hot summer
Let's get under cover
Don't try too hard to think
Don't think at all
You're not the only one starin' at the sun
Afraid of what you'd find
If you took a look inside
I'm not just deaf and dumb
I'm staring at the sun
Not the only one who's happy to go blind
There's an insect in your ear
If you scratch it won't disappear
It's gonna itch and burn and sting
You wanna see what the scratcing brings
Waves that leave me out of reach
Breaking on your back like a beach
Will we ever live in peace
'Cause those that can't do often have to
No, those that can't do often have to preach
To the ones staring at the sun
Afraid of what you'ld find
If you took a look inside
Not just deaf and dumb
Staring at the sun
Not the only one who's happy to go blind
Mexico, Mexico, Mexico
Intransigence is all around
The military still in town
Armour plated suits and ties
Daddy just won't say goodbye
Referee won't blow the whistle
God is good but will he listen
I'm nearly great but there's something missing
I left it in the duty free
But you never really belonged to me
You're not the only one starin' at the sun
Afraid of what you'd find
If you stepped back inside
Sucking on my thumb
I'm staring at the sun
Not the only one who's happy to go blind
Happy to go blind
Happy to go blind
Happy to go blind
I'm happy to go
Happy to go
Happy to go blind"
Staring At The Sun (Live From Rotterdam)	https://www.allthelyrics.com/lyrics/u2/staring_at_the_sun_live_from_rotterdam-lyrics-1119807.html	Please Popheart Live	"Summer stretching on the grass
Summer dresses pass
In the shade of a willow tree
Creeps a crawling over me
Over me and over you
Stuck together with God's glue
It's gonna get stickier too
It's been a long, hot summer
Let's get under cover
Don't try too hard to think
Don't think at all
You're not the only one staring at the sun
Afraid of what you'd find
If you step back inside
Not just deaf and dumb
Staring at the sun
I'm not the only one who's happy to go blind
There's an insect in your ear
If you scratch it won't disappear
It's gonna itch and burn and sting
You wanna see what the scratcing brings
Waves that leave me out of reach
Breaking on your back like a beach
Will we ever live in peace
'Cause those that can't do often have to
No, those that can't do often have to preach
To the ones staring at the sun
Afraid of what you'd find
If you step back inside
Not just deaf and dumb
Staring at the sun
I'm not the only one who's happy to go blind
Intransigence is all around
Military still in town
Armour plated suits and ties
Daddy just won't say goodbye
Referee won't blow the whistle
God is good but will he listen
I'm nearly great but there's something missing
I left it in the duty free
Oh she calls
She never really belonged to me
You're not the only one starin' at the sun
Afraid of what you'd find
If you stepped back inside
Not sucking on my thumb
Staring at the sun
Not the only one who's happy to go blind
Happy to go blind
Happy to go blind
Happy to go blind
Happy to go
Happy to go
Happy to go blind
Happy to go blind
Happy to go blind
Happy to go blind
I'm happy to go
Happy to go
Happy to go blind"
Stateless	https://www.allthelyrics.com/lyrics/u2/stateless-lyrics-1119789.html	Soundtrack - The Million Dollar Hotel	"I've got no home in this world
Just gravity, luck, and time
I've got no home in this world
Just you and you are not mine
Stateless
Weightless
Stateless
Such a girl
There are no colors in your eye
There's no sunshine in your sky
There's no race, only the prize
There is no tomorrow, only tonight
Stateless
It's the difference
You can cover a world with your thumb
Still so big, so bright, so beautiful
Weightless
Stateless
Push down on me
Push down on me
A weight now
A weight down on me
Your weight down
Be the weight, hard
Down on me
Be the heavy hand
The wall of sand
Be the weight, hard
Down on me
Stateless
Weightless
Hateless"
Stay (Faraway, So Close!)	https://www.allthelyrics.com/lyrics/u2/stay_faraway_so_close-lyrics-18524.html	Zooropa	"Green light, 7-Eleven
You stop in for a pack of cigarettes
You don't smoke, don't even want to
Hey now, check your change
Dressed up like a car crash
The wheels are turning but you're upside down
You say when he hits you you don't mind
Because when he hurts you you feel alive
Oh now, is that what it is
Red light, grey morning
You stumble out of a hole in the ground
A vampire or a victim
It depends on who's around
You used to stay in to watch the adverts
You could lip-synch to the talk shows
And if you look, you look through me
And if you talk, you talk at me
And if I touch you, you don't feel a thing
If I could stay, then the night would give you up
Stay and the day would keep its trust
Stay and the night would be enough
Faraway, so close up with the static and the radio
With satellite television you can go anywhere
Miami, New Orleans, London, Belfast, and Berlin
And if you listen, I can't call
And if you jump, you just might fall
And if you shout, I'll only hear you
But if you stay then the night would break its trust
Stay and the day would give you
Stay with the spirit you found
Stay and the night will be enough
And if you listen, I can't call
And if you jump, you just might fall
And if you shout, I'll only hear you
But if you stay then the day would give you up
Stay with the demons you drowned
Stay with the spirit you found
Stay and the night will be enough
Three o'clock in the morning
It's quiet and there's no one around
Just the bang and the clatter as an angel runs to ground
Just the bang and the clatter as an angel hits the ground"
Stay (Faraway, So Close!) (Live From Toronto)	https://www.allthelyrics.com/lyrics/u2/stay_faraway_so_close_live_from_toronto-lyrics-1119928.html	Stuck In A Moment You Can't Get Out Of	"Right, what we'd like to do now is go live from Toronto to London, to the Secret Policeman's Ball, which is a mysterious and extraordinary event that certainly changed my life when I was...I dunno...changable. I still am. This is Stay.
Green light, 7-Eleven
You stop in for a pack of cigarettes
You don't smoke, don't even want
Hey now, I see you check your change
Dressed up like a car crash
The wheels are turning but you're upside down
You say when he hits you you don't mind
Because when he hurts you you feel alive
Oh now, is that what it is
Red lights, grey morning
You stumble out of a hole in the ground
A vampire or a victim
It depends on who's around
You used to stay in to watch the adverts
You could lip-synch to the talk show hosts
And if you look, you look through me
And when if you talk it's not to me
And if I touch you, you don't feel a thing
If I could stay, then the night would give you up
Stay and the day would keep its trust
If I could stay, then the night would be enough
Faraway, so close up with the static and the radio waves
With satellite television you can go anywhere
Miami, New Orleans, London, Belfast from Toronto
And if you listen I can't call
And if you jump, you just might fall
And if you shout, I'll only hear you
If I could stay then the night would give you up
Stay then the day would keep its trust
Stay with the spirit I found
Stay with the demons you drowned
Stay and the night would be enough
Three o'clock in the morning
It's quiet and there's no one around
Just the bang and the clatter as an angel runs to ground
Just the bang and the clatter as an angel hits the ground
Thank you"
Stories For Boys	https://www.allthelyrics.com/lyrics/u2/stories_for_boys-lyrics-18447.html	Boy	"There's a place I go
And I am far away
There's a TV show
And I can grow
Sometimes the hero takes me
Sometimes I don't let go
Hello hello
There's a picture book
With colored photographs
There's a comic strip
That makes me laugh
Sometimes the lady takes me
Sometimes I don't let go
Hello hello
Stories for boys...stories for boys
Stories for boys...stories for boys
Stories for boys...
There's a place I go
And it's a part of me
There's a radio
And I will crawl
Sometimes the hero takes me
Sometimes I can't let go
Hello hello
Stories for boys..."
Stories For Boys (Single Version)	https://www.allthelyrics.com/lyrics/u2/stories_for_boys_single_version-lyrics-1119824.html	U2-3	"There's a place
It takes me far away
There's a TV show where I can grow
Sometimes a hero takes me
Sometimes I don't want to know
Hello, hello
There's a picture book with coloured photographs
There's a comic strip that makes me laugh
Sometimes the lady takes me
Sometimes I don't let go
Hello, hello
Stories for boys
Stories for boys
Stories for boys
Stories for boys
Stories for boys
There's a place I go
It takes me far away
There's a TV show where I can grow
Sometimes a hero takes me
Sometimes I don't let go
Stories for boys
Stories for boys
Stories for boys
Stories for boys
Stories for boys
Stories for boys
Stories for boys
Stories for boys
Stories for boys"
Stranger In A Strange Land	https://www.allthelyrics.com/lyrics/u2/stranger_in_a_strange_land-lyrics-18461.html	October	"Stranger
Stranger in a strange land
He looked at me like I
Was the one who should run
We asked him to smile for a photograph
Waited a while to see if we could
Make him laugh
A soldier asked for a cigarette
His smiling face I can't forget
He looked like you across the street
But that's a long way here
And I wish you were here
And I wish you were here
Stranger
A stranger in a strange land
He look at me like I
Was the one who should run
I watched as he watched us
Get back on the bus
I watched the way it was
The way it was when he was with us
And I really don't mind
Sleeping on the floor
But I couldn't sleep after what I saw
I wrote this letter to tell you
The way I feel
I wish you were here
I wish you were here
To see what I could see
To hear
And I wish you were here"
